NAME,DATE,REVIEW_BODY,PROFILE_PIC,RATINGS_ID
Emmett Wolff,February 2012,"Ipsa incidunt natus. Est qui mollitia debitis asperiores alias officia pariatur fugiat. Laudantium sequi odio harum fugit quia aut rerum eos.
 Ut hic voluptatum maxime asperiores omnis quidem quisquam assumenda veniam. Dolorem minus vero. Eos sint blanditiis soluta qui. Commodi accusamus voluptate qui ipsam eius. Culpa sint architecto.
 Praesentium praesentium ratione et ipsa amet. Aut veritatis omnis maiores. Blanditiis quis voluptatem itaque ut eaque eum porro aperiam tempora. Labore eum delectus aperiam quia eum facilis. Est nisi praesentium.",https://beartnt-profile-photos.s3.us-east-2.amazonaws.com/beartnt+profile+photos/pexels-photo-3851312.jpeg,45
Caroline Skiles,April 2010,"Ut in exercitationem cum. Aut repellendus culpa. Modi doloremque sequi voluptatem sed eveniet blanditiis dolores. Veniam enim rerum. Ipsa dolor cumque eum et.
 Voluptates perferendis dolores nesciunt voluptas consectetur similique vitae nesciunt. Sed commodi inventore eaque quia a. Excepturi sed reiciendis quisquam tempore est. Itaque quis earum perspiciatis aliquam aut. Libero voluptatem ducimus quia nisi.
 Tempore repellat itaque est recusandae rerum blanditiis impedit quidem ut. Impedit adipisci nulla sit corporis neque blanditiis dicta nobis. Mollitia quia sunt voluptatem iste perferendis delectus minus harum. Est autem molestiae et aut.",https://beartnt-profile-photos.s3.us-east-2.amazonaws.com/beartnt+profile+photos/pexels-photo-1310522.jpeg,45
Shelly Lueilwitz,May 2011,"Sint assumenda qui. Illum consequuntur dolorem. Libero id quod optio et et non. Aperiam laboriosam accusamus harum saepe id quis debitis et illo. Perspiciatis dolor delectus ipsam rem totam. Et id officiis hic pariatur provident rerum.
 Accusamus sunt officiis similique excepturi soluta ratione. Autem voluptates inventore nesciunt error quo dolor assumenda nisi dolorem. Omnis sit id quis voluptas aut ea nobis quibusdam aspernatur.
 Voluptas iste assumenda doloremque nisi repudiandae sed consequatur. Consequatur quia ex quo incidunt. Et amet enim odio qui doloribus. Dolor natus laborum voluptatem eveniet vero.",https://beartnt-profile-photos.s3.us-east-2.amazonaws.com/beartnt+profile+photos/pexels-photo-4153618.jpeg,46
Dr. Kari Stehr,April 2019,"A totam mollitia. Quos illo ipsam earum et impedit quia sit magni. Magnam ut repellendus voluptatem cumque.
 Aut natus accusamus repudiandae vel. Voluptate delectus quisquam. Et tempore magni tempore architecto illo voluptas architecto eum. Dolores ea et mollitia cupiditate voluptatem. Ut non voluptas modi eligendi et consequatur voluptatem et fugiat. Molestias omnis voluptas impedit dolore eum sint.
 Dolor tempora perspiciatis. Ipsa ad dolores repellendus rerum error velit repellat dignissimos. Accusantium ea temporibus voluptatem.",https://beartnt-profile-photos.s3.us-east-2.amazonaws.com/beartnt+profile+photos/pexels-photo-4626351.jpeg,46
Glenn Kling,March 2009,"Dolor labore velit quos aperiam repellendus non. Dolore dolore id et architecto enim ut molestias. Et quibusdam vero.
 Dolor aut aut sed aut quisquam velit. Laborum quod ipsa iure facilis veritatis dicta. Rerum quia qui eos ab.
 Maxime alias voluptatem. Dolor est ipsa. Minus rerum in non sed est rerum quasi. Occaecati error est laudantium cumque non. Adipisci mollitia dicta commodi vel porro molestiae molestiae.",https://beartnt-profile-photos.s3.us-east-2.amazonaws.com/beartnt+profile+photos/pexels-photo-4886781.jpeg,46
Mrs. Stephanie Mann,September 2008,"Accusamus amet velit et. Reprehenderit officiis temporibus nam perspiciatis ut ut ut. Dolore molestiae explicabo. Qui totam non molestiae est quidem. Aut et eius sint ipsam cum.
 Est sunt at aut voluptas necessitatibus. Nulla dignissimos voluptatem aliquam et accusamus amet. Ut est cumque qui aperiam tempore exercitationem repudiandae.
 Reprehenderit minus saepe. Adipisci et officia. Vero est pariatur vero cupiditate dolor non repudiandae autem sapiente. Ut perspiciatis rem reiciendis. Vero voluptatem harum laborum.",https://beartnt-profile-photos.s3.us-east-2.amazonaws.com/beartnt+profile+photos/pexels-photo-220453.jpeg,46
Maggie Boehm,April 2009,"Iste occaecati similique doloremque rerum est sunt dolores exercitationem deserunt. Tempora consequatur officiis quia laborum ut aut quia. Consequatur molestias ut odit. Et voluptas quos esse. Vel sint eveniet sit et.
 Quod est enim id eum vitae exercitationem minus. Repellendus voluptatibus dolore. Quo voluptates voluptate ut quis asperiores ullam officiis non. Eaque qui sed. Quia ea natus enim veniam eligendi velit qui qui delectus. Repudiandae eaque cupiditate aliquid ullam rerum saepe.
 Quos pariatur totam vel. Officiis nulla expedita omnis ea in quaerat. Id illo ducimus dolorum deleniti at nam unde minus.",https://beartnt-profile-photos.s3.us-east-2.amazonaws.com/beartnt+profile+photos/pexels-photo-5853675.jpeg,46
Carl Bartell,August 2019,"Laborum odit labore voluptas eum harum non. Rem voluptas dignissimos. Reiciendis id autem deleniti sint repellat a laudantium deserunt. Qui autem velit repellat recusandae. Repellendus ut magnam natus vel magni. Officiis est pariatur aliquam vel vitae.
 Occaecati perferendis distinctio voluptate enim distinctio placeat. Harum ducimus deleniti laboriosam eveniet qui dolor. Est ratione perferendis odio pariatur expedita est exercitationem officia. Aut unde ut inventore est vel officia. Non rerum amet excepturi accusamus et assumenda sint et nesciunt. Recusandae doloribus tempora natus et et quia et porro.
 Non voluptatum eius commodi ullam. Dolore neque accusamus harum facere ut necessitatibus modi repellendus. Ex dolores neque quas consequatur.",https://beartnt-profile-photos.s3.us-east-2.amazonaws.com/beartnt+profile+photos/pexels-photo-1484810.jpeg,46
Margarita Baumbach,May 2011,"Cupiditate ut facere omnis perspiciatis hic. Qui dolore vitae voluptatem nihil ratione qui soluta adipisci. Doloribus voluptatum sint id deserunt sed quo et. Omnis consequatur vero debitis suscipit. Iusto tempora dolor expedita voluptatem optio fuga eius. Tempora suscipit amet quis ut impedit blanditiis debitis.
 Sapiente velit aspernatur voluptatum rerum vitae porro. Ut adipisci recusandae possimus dicta quaerat quia. Dolorem placeat aliquam at ut ea architecto aliquam. Veniam sed velit maiores nostrum et consectetur velit.
 Necessitatibus eos ut voluptatem quia tempora saepe et sint natus. Maiores autem assumenda ab et repudiandae possimus dolores. Totam voluptas perferendis ut aut molestiae non placeat. Quis facilis iure sapiente delectus quisquam placeat quisquam. Hic provident impedit.",https://beartnt-profile-photos.s3.us-east-2.amazonaws.com/beartnt+profile+photos/pexels-photo-4123910.jpeg,46
Robin Konopelski,March 2008,"Praesentium aut nam dolores inventore eveniet est. Deserunt aut error sed fugit sed incidunt dolor tenetur id. Saepe alias rerum. Ipsum odit excepturi aliquam aut sequi voluptates quia. Odio veritatis neque animi. Fuga minima cumque non nesciunt aut et.
 Qui natus beatae. Ex sit recusandae enim fuga. Vel qui dolorem explicabo repellat.
 Quod corporis qui qui quia quos sed molestiae expedita. Qui sint omnis est itaque. Dolorum consequatur quia nisi dignissimos provident veniam. Molestiae voluptates at blanditiis ex molestias omnis. Dolore praesentium laudantium sunt accusantium non.",https://beartnt-profile-photos.s3.us-east-2.amazonaws.com/beartnt+profile+photos/pexels-photo-4886801.jpeg,46
Earnest Goodwin,September 2018,"Aut libero tempore quos ducimus labore ex quibusdam odio. Corporis inventore ratione esse dicta accusantium. Nam totam ipsa aut repudiandae.
 Praesentium nostrum sunt vero cumque sit deleniti accusantium. Ullam consequuntur nobis suscipit animi ipsam atque. Rerum in aut id similique nostrum. Blanditiis vel voluptas perspiciatis voluptatum vel temporibus harum eum iste. Repellendus omnis sit accusamus soluta aut aut velit iusto aperiam.
 Ipsam odit voluptatum nostrum voluptas laboriosam. Cum dolore exercitationem et. Accusamus autem autem qui. Eos ullam quos et optio maxime sunt enim. Beatae quo sit et facilis voluptas est qui aliquid odit. Maxime corporis aut occaecati sed cumque qui repellat quo sed.",https://beartnt-profile-photos.s3.us-east-2.amazonaws.com/beartnt+profile+photos/pexels-photo-3970387.jpeg,47
Darrel Rau,March 2011,"Consequatur eum quo. Ut ut ducimus ut est itaque architecto. Animi ullam ut non explicabo rerum eius natus quaerat voluptatem.
 Sequi eveniet est quis est expedita ipsa. Quas impedit recusandae tenetur neque impedit. Voluptatem est consequuntur officia accusantium saepe aspernatur omnis sed. Vel voluptate quis. Sit architecto dolore ut vel error repellendus.
 Dolorem cupiditate laudantium mollitia omnis fugit eos eius qui. Explicabo veniam optio officiis. Necessitatibus molestiae laudantium dicta blanditiis.",https://beartnt-profile-photos.s3.us-east-2.amazonaws.com/beartnt+profile+photos/pexels-photo-3775540.jpeg,47
Elmer Baumbach,May 2013,"Blanditiis ut voluptatem reiciendis est omnis delectus. Ut enim fugiat explicabo voluptatem quis et vel. Maiores architecto tenetur sed et voluptas. Molestiae placeat laudantium qui. Ex qui totam neque laborum. Ut nulla nostrum quia rerum rerum corrupti dolore ut.
 Nihil aliquid odit architecto magnam quia cum. Recusandae aspernatur fuga sapiente est fuga ut et autem. Similique nobis beatae. Rerum aliquid recusandae rerum. Explicabo ab atque quo amet ut minus velit quae.
 Ut dolor aut cum repudiandae doloremque eaque. Non laudantium rerum officia neque quisquam culpa nulla omnis nam. Necessitatibus pariatur ullam accusantium. Accusantium quas consequatur eos est sit. Placeat architecto dolor suscipit earum. Quod perspiciatis accusamus ea.",https://beartnt-profile-photos.s3.us-east-2.amazonaws.com/beartnt+profile+photos/pexels-photo-4626351.jpeg,47
Mrs. Chester Wilderman,March 2018,"Quia sed molestiae repellat laborum mollitia vero nihil provident pariatur. Illo dolor pariatur hic pariatur voluptatum. Rerum itaque sint sed voluptas atque. Provident corrupti culpa odit aperiam eum quod quidem ut.
 Et illum doloremque officia sed cumque ipsum harum. Et quasi libero nihil velit fuga praesentium. Sit laboriosam cupiditate ut expedita aut facilis.
 Earum dolore aut sit impedit quia. Eaque fuga officiis dolorum. Fuga laudantium voluptates libero voluptatem possimus doloribus. Suscipit enim omnis voluptas quia delectus. Cumque iure vero nostrum optio.",https://beartnt-profile-photos.s3.us-east-2.amazonaws.com/beartnt+profile+photos/pexels-photo-3770317.jpeg,47
Al Kihn,December 2010,"Sit similique veritatis consectetur qui doloribus facere. Tenetur dolorem similique earum laboriosam non sequi quae distinctio at. Voluptate delectus magnam nobis eius sed.
 Vero eum impedit voluptate. In dolores quae. Vitae necessitatibus laudantium occaecati voluptatum labore soluta sed sit. Illo culpa voluptatem et et ratione eius facilis tempora.
 Odit nihil molestiae et exercitationem ad et sint. Repellendus voluptatum cum est eaque dolore dolor ea. Unde odit minus sunt expedita ab laborum cumque ut eveniet. Odio dolore sint repellat delectus tempora. Consequatur sed porro tenetur praesentium facere necessitatibus rerum. Tempora doloribus quia quam in commodi ut exercitationem aut.",https://beartnt-profile-photos.s3.us-east-2.amazonaws.com/beartnt+profile+photos/pexels-photo-4886801.jpeg,47
Theodore Kreiger III,September 2009,"Molestiae eos sunt sit delectus culpa maxime ad. Inventore sunt molestiae dolores in et. Dignissimos consequatur doloremque non labore quia dolor.
 Ut rem qui neque aspernatur expedita nihil itaque error. Ullam neque modi et perferendis cum optio ea eum. Repudiandae est rerum deleniti harum. Id esse perferendis.
 Qui et odio eos eaque perferendis omnis ea sapiente. Nihil laboriosam reprehenderit dignissimos voluptas rerum corporis. Quis perspiciatis non maxime autem eum officia. Ipsa sint nam et voluptatem sunt sunt. Voluptatem quidem ut. Pariatur fugiat sint asperiores et totam neque.",https://beartnt-profile-photos.s3.us-east-2.amazonaws.com/beartnt+profile+photos/pexels-photo-4100670.jpeg,47
Veronica Kiehn DDS,July 2008,"Voluptatem velit architecto cupiditate et fugiat et amet. Iusto id nam eaque. Vel rerum nihil id autem omnis eius amet nisi qui. Exercitationem ipsum est fugit et sed atque sed.
 Quisquam qui quidem nulla ut quo nihil est quaerat culpa. Quam beatae voluptates. Omnis harum expedita dolorem deserunt maiores autem enim facere. Repellat quo molestiae ut fuga consequatur. Rerum non in. Beatae officiis molestiae eos.
 Exercitationem iste ut rerum illum aliquid hic. Illum quas accusantium laborum fugit dolore quaerat quidem voluptatem similique. Quia fugit incidunt et unde tempore at. Et in ex quasi.",https://beartnt-profile-photos.s3.us-east-2.amazonaws.com/beartnt+profile+photos/pexels-photo-415829.jpeg,47
Patti Bergnaum,January 2010,"Debitis reprehenderit ad sed sequi alias aliquid sunt et. Eos reiciendis aut illum eos sint animi. Tenetur qui eligendi placeat alias aut et fugit autem nisi. Dolore recusandae quisquam ut laudantium maxime et. In sint consequatur nulla tenetur dolores dicta repellendus. Autem qui fugiat sit eligendi.
 Et ut cumque libero accusantium exercitationem repudiandae. Corrupti et dolores et. Et nobis non. Doloremque iusto et et sed ea sunt. Et beatae ut.
 Est voluptates dolorum. Dolor et aspernatur et necessitatibus quas praesentium quidem quibusdam dolorem. Totam sunt animi quia enim itaque velit nemo repudiandae. Aut ad laudantium ea ea aut. Ab porro quia.",https://beartnt-profile-photos.s3.us-east-2.amazonaws.com/beartnt+profile+photos/pexels-photo-1310522.jpeg,47
Robyn Howell,July 2020,"Quia odio illo doloribus ab praesentium cumque necessitatibus odio molestias. Nemo ut voluptatem. Recusandae minus ut magni fugit harum fugiat. Temporibus ut recusandae nihil porro sed.
 Est unde quia consequatur deserunt quod pariatur tempora ea aperiam. Ab eius et impedit iusto placeat nobis officiis. Reiciendis est velit quasi dolore inventore fuga voluptas. Quia aspernatur iusto harum asperiores aperiam aliquam. Aut aut aut inventore illo dicta et. Asperiores ullam ab sint quos.
 Quia veritatis ea qui aut quo pariatur aliquam sunt. Incidunt aut quod ea. Impedit praesentium voluptate.",https://beartnt-profile-photos.s3.us-east-2.amazonaws.com/beartnt+profile+photos/pexels-photo-4123910.jpeg,47
Drew Osinski,December 2020,"Et earum sint. Cum dicta maxime. Possimus et eum asperiores voluptatem et sint tempore saepe. Aut dolore quas odit voluptas impedit distinctio.
 Quam rerum porro impedit nulla doloremque qui. Excepturi suscipit vero et voluptates voluptatibus inventore. Consequatur et nulla pariatur labore minima eum est et.
 Quo non rem et ratione sit doloremque in quasi. Eligendi soluta maxime architecto impedit quam explicabo blanditiis voluptatem est. Nihil nihil laboriosam optio quia inventore. Atque aut exercitationem commodi dignissimos et consequatur ullam at. Vel voluptas natus.",https://beartnt-profile-photos.s3.us-east-2.amazonaws.com/beartnt+profile+photos/pexels-photo-1484810.jpeg,47
Verna Vandervort,September 2014,"Ad et libero deserunt ullam iusto ullam. Nam natus error et. Possimus nihil adipisci aut quo odit et. Consequatur vero dolores ut qui corrupti repellendus facilis. Quo autem voluptatibus quibusdam hic.
 Consequatur sint voluptate necessitatibus explicabo illum voluptatum vel recusandae corrupti. Veniam velit rerum dolorum voluptates sed ut. Earum et est. Assumenda omnis dignissimos voluptas sunt aut dolor quam.
 Vel velit magnam quidem et incidunt fuga voluptatem optio. Voluptatibus explicabo nesciunt. Officia voluptatem voluptas aut. Similique assumenda ad iste ut. Deserunt nihil aliquid adipisci ratione illo dolores.",https://beartnt-profile-photos.s3.us-east-2.amazonaws.com/beartnt+profile+photos/pexels-photo-3851312.jpeg,47
Donald Brekke,January 2017,"Ut et omnis illo laborum autem. Dolor minima qui suscipit ut omnis qui iure repellat. Voluptates dolor quo animi qui et perspiciatis ut omnis autem. Neque sint fugit deserunt consequuntur iste dignissimos vel vero eveniet.
 Culpa adipisci et. Quia est id repellendus. Quo reprehenderit impedit illo et laborum iusto minima. Nihil recusandae nemo inventore est sed perspiciatis facilis nihil ut. Incidunt quaerat non. Quia soluta nulla nostrum ipsum vel.
 Ab est non. Minima quia ullam facilis qui non. Alias reiciendis voluptatibus dolores corrupti eius. Placeat incidunt similique vel itaque libero minus eligendi sed. Temporibus placeat maxime qui est nihil.",https://beartnt-profile-photos.s3.us-east-2.amazonaws.com/beartnt+profile+photos/pexels-photo-5853675.jpeg,47
Sonja Stamm,June 2010,"Officia omnis officia eum quis. Et enim alias. Accusantium aliquam voluptatum dolor laudantium. Sunt velit distinctio molestias et. Quae quae sunt laboriosam ut eaque odit eius eveniet ut.
 Itaque cumque excepturi. Qui perspiciatis ut neque et voluptatibus. Ratione error qui ex dolorem mollitia quod. Tenetur aut sed sapiente reprehenderit rerum dolore consequatur et.
 Odit earum error rerum. At eum ipsam corporis. Expedita quia nihil rerum nulla non non. Sint cupiditate modi. Dolor eum ipsum aspernatur qui numquam officiis et.",https://beartnt-profile-photos.s3.us-east-2.amazonaws.com/beartnt+profile+photos/pexels-photo-4153618.jpeg,47
Dan Monahan,June 2018,"Quo et aliquid illum quia quam in voluptatem voluptatibus. Modi nostrum at quae vero. Est quisquam consequatur occaecati nihil sit nesciunt fugit a. Non laudantium rem.
 Numquam temporibus pariatur qui et eum quis amet. Voluptas earum ea qui sed dolorem maxime illo. Similique eligendi dolores cum repellendus sit impedit. Quo deleniti sed repudiandae sunt.
 Magni ut et cum aut est est tenetur rerum vero. Perferendis ut omnis rerum qui provident provident quia nulla et. Et minima aut omnis qui sed aut ex consequatur. Et inventore voluptatem incidunt. Corrupti autem aliquid veniam et dolorum vitae aut.",https://beartnt-profile-photos.s3.us-east-2.amazonaws.com/beartnt+profile+photos/pexels-photo-220453.jpeg,47
Percy Yost,July 2012,"Reiciendis culpa ratione. Dolores unde sit adipisci non. Distinctio sed ratione praesentium nihil incidunt odio voluptatem suscipit.
 Minima voluptas iure ex unde et quis quas veniam consequuntur. Debitis veritatis sit ratione est aliquid est qui. Illum tempora culpa quae libero quis atque. Velit incidunt hic aut. Numquam sed et cupiditate quae soluta. Accusamus velit saepe et sunt tempora cumque laborum.
 Qui culpa earum quia quidem. Illum minima fugit quo voluptatem et suscipit accusantium ad. Dolorum quia repellat blanditiis magnam nobis sequi dolores.",https://beartnt-profile-photos.s3.us-east-2.amazonaws.com/beartnt+profile+photos/pexels-photo-3851312.jpeg,48
Wendy O'Keefe IV,April 2018,"Sit et suscipit libero ea doloremque molestias sit quis. Ullam blanditiis similique possimus. Sint quia voluptates ipsum est optio. Optio laborum autem asperiores. Vero sit quis assumenda consequatur.
 Dolor quisquam consequatur consectetur consequuntur veniam occaecati harum. Facilis maiores aut eos odio id sapiente mollitia fugiat. Optio voluptate voluptatem sequi sapiente quia optio vel. Autem nobis et minima quia molestiae. Laboriosam tenetur delectus autem. Commodi sit architecto sit cupiditate.
 Est aut accusantium beatae in adipisci vel. Sed impedit odit ad autem porro ut voluptas quas. Et delectus eos ipsum voluptatibus. Et fugiat magni consectetur.",https://beartnt-profile-photos.s3.us-east-2.amazonaws.com/beartnt+profile+photos/pexels-photo-4626351.jpeg,48
Maureen Thiel,November 2018,"Molestias hic fuga rem at eos. Reprehenderit itaque id. Corrupti rerum vero necessitatibus. Vitae iusto est quis.
 Rerum et aut et necessitatibus ipsa. Quis exercitationem expedita laborum adipisci repudiandae hic sunt. Similique aut dolorem sed vero voluptatum repudiandae. Sit ipsum asperiores eaque vero rerum labore tempora. Eligendi facere est nihil rerum dolor. Fugit est ab.
 Maiores debitis eligendi sint quia beatae. Consequatur et et itaque optio sunt expedita facere. Dolor soluta enim alias. Consequatur laboriosam aut deserunt nihil praesentium vel officiis est.",https://beartnt-profile-photos.s3.us-east-2.amazonaws.com/beartnt+profile+photos/pexels-photo-1310522.jpeg,48
Ms. Marc Beer,June 2017,"Veniam accusamus omnis adipisci sint libero est necessitatibus et. Sunt voluptas dolor molestiae quia quia. Aut atque accusantium eos veniam. Praesentium consequatur sit dolorum perspiciatis velit ad fugiat.
 Molestiae voluptatem doloribus nam quod fugit id. Dolor impedit quisquam sunt rem praesentium rerum maiores qui repudiandae. Ex nemo temporibus et nam in error alias adipisci dignissimos.
 Ea praesentium numquam nulla. Eaque quis placeat officiis in et ea aut est animi. In quis in ut laudantium. Ipsum corrupti ipsam est ipsam earum expedita. Ea totam laborum qui rem dolorum iure est repudiandae. Aut non perferendis.",https://beartnt-profile-photos.s3.us-east-2.amazonaws.com/beartnt+profile+photos/pexels-photo-4100670.jpeg,48
Jordan Hettinger,December 2017,"Eveniet quia et provident ut sequi. Necessitatibus in sunt repellat minima. Libero et sit consequatur eum et quis ipsa omnis. Libero et quo molestiae ut aut nihil dolorem molestiae impedit. Rerum amet cumque esse in dolores.
 Voluptatem alias aut aliquam. Ut non autem. Dolorum molestiae facere tempore suscipit laboriosam eligendi enim.
 Sit quod ut. Odio in accusantium earum ab est facere officiis. Debitis et facilis ut fugiat voluptatem. Repudiandae eius sed esse atque itaque eum est repellendus dolores. Dolores illo labore illo voluptas consequatur cupiditate illo nihil qui. Et optio ex a nostrum.",https://beartnt-profile-photos.s3.us-east-2.amazonaws.com/beartnt+profile+photos/pexels-photo-2726111.jpeg,48
Christina Aufderhar,September 2010,"Et consequatur accusantium nulla et aspernatur quod facilis. Et hic qui odit velit recusandae. Aut et hic. Quaerat maxime sit eos rerum quidem quia inventore quia sapiente.
 Nam non aut recusandae aspernatur incidunt dolorum voluptas molestias. Enim molestiae accusamus explicabo dicta velit ut ipsa iusto nulla. Officiis harum voluptatibus et expedita tempore voluptatum eum similique. Quae sit veritatis eligendi quisquam minima quis rerum ratione.
 Optio suscipit facilis id quasi illo tempora. Aut minus nihil molestiae. Quia sunt quisquam unde rem voluptas. Ad reiciendis reprehenderit maiores libero animi.",https://beartnt-profile-photos.s3.us-east-2.amazonaws.com/beartnt+profile+photos/pexels-photo-220453.jpeg,48
Beth Trantow,December 2011,"Exercitationem consequuntur aut. Tempore est facere possimus consectetur quaerat sint alias. Explicabo sunt numquam provident blanditiis molestiae quasi provident neque vitae. Sequi vero nihil blanditiis adipisci aut tenetur facilis beatae ex. A aliquam nobis reprehenderit veritatis ex.
 Enim dolor est praesentium rerum eos sed ut eveniet et. Dicta sit dicta tempore doloribus alias fugiat. Velit reiciendis nulla quos ratione quod enim consequuntur. Ratione itaque officia sit animi dolorum laboriosam eveniet voluptatem.
 Praesentium voluptatem assumenda facilis sunt. Cumque qui qui debitis. Et sit eaque vel officia vitae est fugit quia.",https://beartnt-profile-photos.s3.us-east-2.amazonaws.com/beartnt+profile+photos/pexels-photo-4123910.jpeg,48
Reginald Reinger,September 2011,"Voluptatibus animi natus enim pariatur et expedita sequi nihil. Et quaerat aut. Labore inventore id earum atque voluptatem. Consectetur illo adipisci minima fuga nesciunt.
 Et animi blanditiis cumque reprehenderit error. Sint totam nobis. Dolorem optio enim eos omnis. Laboriosam ut perferendis numquam magni. Facere dolores quod reprehenderit optio. Aliquam odit laboriosam optio incidunt dolor vel.
 Omnis id ad non. Optio ipsa expedita consequatur ea aliquid mollitia rerum ipsam ut. Nisi ratione dolores fugit minima sit autem odit id eligendi. Ut eveniet porro ratione tempore eaque. Esse et velit adipisci nobis culpa aliquam et.",https://beartnt-profile-photos.s3.us-east-2.amazonaws.com/beartnt+profile+photos/pexels-photo-1484810.jpeg,48
George Hickle,November 2017,"Nobis unde maiores necessitatibus. Et quam non eveniet. Velit rerum quisquam ullam corporis pariatur. Et tenetur voluptas voluptatibus dolores aperiam amet omnis quia voluptas. In qui odio odio qui saepe minus fugiat tempora impedit.
 Sunt tempore tempore non ex aut. Molestiae est quia fugit voluptatem similique. Odio in laudantium optio omnis ut.
 Labore officia iusto hic provident provident rerum. Consequatur et ratione est repellat voluptatibus consequatur eaque. Quibusdam officiis magnam nam repellendus. Eum ut et laboriosam vel cumque quibusdam deserunt recusandae.",https://beartnt-profile-photos.s3.us-east-2.amazonaws.com/beartnt+profile+photos/pexels-photo-415829.jpeg,48
Vivian Barton DVM,July 2016,"Qui corporis qui eos ipsam. Perferendis minima est enim quod explicabo qui ut. Enim quis quo ab.
 Laborum architecto aut eligendi. Harum maxime est dignissimos architecto magni. Repellendus debitis aut vel sit enim et illum facilis. Totam iure eius ut voluptatum nam sequi ut consequatur et. Soluta eligendi ab sint praesentium consequuntur quo.
 Error tempora porro quos in dolorem. Sapiente fugit molestias. Eligendi magni eum ducimus molestiae perferendis sunt. Accusamus ab distinctio.",https://beartnt-profile-photos.s3.us-east-2.amazonaws.com/beartnt+profile+photos/pexels-photo-5853675.jpeg,48
