NAME,DATE,REVIEW_BODY,PROFILE_PIC,RATINGS_ID
Pearl Nader,July 2013,"Quis totam ipsam. Laboriosam magnam quia enim. Magnam aperiam debitis saepe. Quas quia nemo est.
 Iusto molestias aut voluptatibus. Minus eligendi voluptatem eum sed voluptate ex illo molestiae et. Provident magnam corrupti molestias placeat modi dolores reiciendis voluptatem blanditiis. Dolore non omnis ducimus. Est sit expedita quibusdam aut consequuntur voluptatem ipsam quas ex.
 Quae sequi blanditiis beatae iste amet. Culpa dolores aperiam exercitationem magni rerum accusantium quibusdam sapiente error. Omnis eveniet esse. Repellat reiciendis sunt qui qui accusamus.",https://beartnt-profile-photos.s3.us-east-2.amazonaws.com/beartnt+profile+photos/pexels-photo-2726111.jpeg,70
Elmer Toy V,December 2008,"Id fuga id dicta. Sapiente totam culpa laudantium voluptatibus placeat temporibus. Magni nostrum sint. Praesentium rerum voluptatum vero nihil.
 Dolorem aliquid fuga quia est voluptatem adipisci et. Quia consequuntur soluta incidunt. Sed aut exercitationem necessitatibus unde.
 Culpa modi alias. Tenetur in cumque nisi voluptate dolorem natus rerum consequatur. Placeat voluptatem similique consequatur beatae eveniet fuga omnis veritatis quae. Et omnis labore repellat repellat aspernatur.",https://beartnt-profile-photos.s3.us-east-2.amazonaws.com/beartnt+profile+photos/pexels-photo-415829.jpeg,70
Sergio Walter,June 2012,"Et quia vel. Esse nihil et dolorem tenetur cum. Aliquid deserunt quae in facere non enim repellendus earum. Commodi fugit similique harum sint dicta reprehenderit voluptatem. Qui ipsum nulla vel quasi.
 Molestiae vel sed maxime excepturi perferendis quod quam quis. Eum sit iste sequi eligendi tenetur doloribus ut soluta. Quia excepturi amet. Ipsa ut recusandae fuga voluptates eaque architecto rerum beatae alias. Dicta molestiae ea voluptate reiciendis. Rerum qui soluta eius animi provident nostrum quaerat odio.
 Ad iste ex culpa. Sit at sit veniam ad possimus eum hic. Facilis reprehenderit repellendus repellendus saepe sequi voluptatum.",https://beartnt-profile-photos.s3.us-east-2.amazonaws.com/beartnt+profile+photos/pexels-photo-3970387.jpeg,71
Eva Hoppe,August 2014,"Tempora impedit sit ipsam odit sit nam. Maxime dolores et laudantium. Quidem ab vero.
 Molestiae alias est. Est modi voluptatibus corrupti illum dolor et commodi. Quia officia nisi. Accusamus nostrum harum. Repellat occaecati id est beatae dicta officia consectetur sit aut.
 Iste pariatur necessitatibus qui. Ut quod sit dolorum accusamus. Eos libero eaque aliquid facere voluptatum labore amet et. Dolorum qui voluptatem.",https://beartnt-profile-photos.s3.us-east-2.amazonaws.com/beartnt+profile+photos/pexels-photo-2726111.jpeg,71
Pablo Dickinson,March 2018,"Et cum ut. Eum dolorem in vel vel quia. Qui alias rerum. In sit quo aliquam optio officia voluptatem.
 Est fugit est excepturi officia vitae. Quibusdam ut ipsa exercitationem doloribus. Sit rerum in quis nulla. Molestias natus dolores autem quos eos culpa et. Deserunt maiores modi enim blanditiis voluptatem.
 Aperiam molestiae sint beatae. Aut placeat occaecati ut occaecati quia reiciendis autem. Laborum laudantium tempore. Eum et facere qui nisi eum sapiente et ut harum.",https://beartnt-profile-photos.s3.us-east-2.amazonaws.com/beartnt+profile+photos/pexels-photo-1310522.jpeg,71
Dianne Rutherford,March 2015,"Atque maiores aut aliquam tempore distinctio ut veritatis nesciunt veritatis. Praesentium cumque saepe perferendis. Sapiente quos a non odio. Commodi molestias sit natus. Deserunt pariatur aspernatur et. Et ut sit ab molestiae voluptas corrupti eius vel sunt.
 Neque consequatur ut repellendus dicta numquam dignissimos sapiente. Nesciunt harum aut modi sequi eligendi corrupti. Omnis ut quo ratione. Non provident aut molestiae dolorum ipsa. Molestiae vel voluptas consequatur.
 Illo deleniti in molestias earum dicta. Repellendus numquam illum natus quae ullam. Nulla quas aut animi.",https://beartnt-profile-photos.s3.us-east-2.amazonaws.com/beartnt+profile+photos/pexels-photo-4100670.jpeg,71
Benjamin McGlynn,November 2014,"Maxime consequatur modi architecto quia ad expedita at incidunt fuga. Aut sunt animi. Eaque voluptas quaerat officiis unde sunt.
 Non est maxime. Voluptatem aperiam ipsum hic explicabo laborum. Optio sint nulla. Qui est ut. Labore assumenda sunt accusantium consectetur vero qui dignissimos exercitationem. Qui dolore quae at.
 Fugit similique tempore similique blanditiis. Voluptatibus et explicabo sed facilis voluptatem et quia illum odit. Quo soluta voluptatem inventore et ut eum veniam rerum. Ut quaerat reiciendis veritatis quod fugit rerum. Nesciunt est eos quaerat.",https://beartnt-profile-photos.s3.us-east-2.amazonaws.com/beartnt+profile+photos/pexels-photo-4886801.jpeg,71
Emanuel Corwin,September 2011,"Eveniet quis provident aut praesentium perferendis. Et fugit voluptatem expedita non quo ratione ducimus aliquid ullam. Nesciunt consectetur accusamus. Suscipit a voluptate nihil laborum.
 Et nam quisquam animi id quae soluta assumenda dolore. Dignissimos omnis ex possimus rerum in sequi et iure. Aut maxime repellat aliquam mollitia doloremque at earum reiciendis temporibus. Vitae laudantium omnis beatae numquam rem dicta expedita non odit. Iure explicabo eos ipsum. Quidem totam voluptas cum omnis vel nostrum perferendis ea.
 Perspiciatis adipisci id consequatur qui. Nihil necessitatibus nemo. Neque et et dolore fugit eos.",https://beartnt-profile-photos.s3.us-east-2.amazonaws.com/beartnt+profile+photos/pexels-photo-1484810.jpeg,71
Dora Hansen,August 2014,"Laborum mollitia non porro in officia facere enim. Officiis qui doloremque odio temporibus officia non. Voluptatum excepturi nobis quisquam et aut omnis praesentium. Consequatur reiciendis alias.
 Facilis quis quis harum molestiae ea et. Minus blanditiis nisi nam ut ut rem nobis. Nihil asperiores pariatur magnam aut. Consequatur omnis vero non ad. Maxime et aliquid nisi ducimus accusantium rerum dolor et et.
 Voluptate est sunt. Consequatur ut earum est ducimus. Maiores error pariatur incidunt delectus sit. Optio officia amet omnis aut quibusdam laborum. Quis atque qui.",https://beartnt-profile-photos.s3.us-east-2.amazonaws.com/beartnt+profile+photos/pexels-photo-3770317.jpeg,71
Francis Nienow,September 2009,"Alias unde doloribus ut maxime ullam eveniet facilis. Maxime ut aliquid provident saepe molestiae rerum cumque pariatur. Consequatur culpa dolor et eaque. Molestiae nemo eum ea consectetur suscipit iste commodi. Harum et magnam quis. Iusto ut recusandae.
 Sint sint quasi animi dolore. Rem veniam distinctio consectetur distinctio repellat velit et sit. Aperiam voluptate dolorem iusto officiis est repellendus delectus optio pariatur.
 Dignissimos necessitatibus culpa porro unde nulla modi omnis est. Quaerat dolor earum et veritatis eum voluptatum et a ipsa. Minus in reprehenderit recusandae sit.",https://beartnt-profile-photos.s3.us-east-2.amazonaws.com/beartnt+profile+photos/pexels-photo-415829.jpeg,71
Luther Gleason DVM,April 2009,"Tempora velit et earum impedit quibusdam occaecati veniam. Doloribus quia asperiores at et error consequatur. In omnis in nihil. Culpa voluptas veritatis. Repellendus nostrum dolores est exercitationem sequi et magnam. Neque vel nisi inventore.
 Dolores aliquid velit eveniet eaque rem sequi. Explicabo qui quam deleniti aut consequatur animi molestiae minima. Ipsam non ratione natus et architecto debitis dolor vero. Repellat quis architecto voluptatum aut libero repudiandae perspiciatis accusamus. Quis similique et autem labore.
 Vel culpa ut omnis adipisci et quia reiciendis. Dicta rem vero voluptas itaque nobis enim consequuntur odio. Placeat pariatur est nobis quis. Qui voluptatem eos labore iure saepe non voluptas. Modi adipisci sunt et in. Aperiam sunt dolorem sunt nesciunt dolorem ut.",https://beartnt-profile-photos.s3.us-east-2.amazonaws.com/beartnt+profile+photos/pexels-photo-4153618.jpeg,71
Oscar Breitenberg,June 2009,"Natus earum quisquam sit temporibus autem rem cumque. Iusto eveniet natus rem quia at laudantium libero. Quaerat ipsam incidunt atque reiciendis et. Voluptatem esse nemo.
 Suscipit illo at aperiam rerum molestiae. Quos voluptatem et repudiandae iusto nihil aliquam fuga enim debitis. Cumque maxime perferendis. Et tempora cum commodi. Explicabo mollitia debitis suscipit velit dolore illo illo.
 Et molestias error laborum molestias dolorem laudantium assumenda sapiente. Eveniet laborum sunt quia corporis consequatur quidem voluptas possimus labore. Voluptatem quae temporibus amet aperiam et. Explicabo maxime dolor possimus assumenda molestiae est repellat. Labore qui repellat architecto quae quibusdam alias ullam.",https://beartnt-profile-photos.s3.us-east-2.amazonaws.com/beartnt+profile+photos/pexels-photo-3770317.jpeg,72
Sadie Leuschke,April 2008,"Praesentium qui fugiat culpa veritatis omnis est a qui. Sint libero repellendus. Error nulla voluptatibus et. Ipsam eum nihil veritatis et praesentium consequatur incidunt velit et.
 Qui laboriosam non alias ut esse. Amet minus voluptatem dolores a eaque et ducimus. Molestias non nostrum excepturi quibusdam.
 Accusamus inventore consectetur quod. Voluptatibus excepturi voluptas. Error dolorem eaque officiis cupiditate quis voluptatem debitis sequi.",https://beartnt-profile-photos.s3.us-east-2.amazonaws.com/beartnt+profile+photos/pexels-photo-3970387.jpeg,72
Wilbert Boyer,May 2015,"Cum adipisci vero rerum voluptatem commodi nihil. Aperiam et atque. Aperiam aut reiciendis sit. Aperiam cum voluptatibus culpa quia suscipit. A consequatur expedita.
 Praesentium dolorem totam deleniti aperiam velit. Et labore quaerat. Voluptatum tenetur sit blanditiis beatae quam dolor doloribus expedita excepturi. Saepe earum dolorem nostrum cumque voluptatem perferendis aliquam quas harum. Voluptatibus rem ut excepturi beatae eveniet velit.
 A vitae ut sit nulla velit veniam voluptas ipsum ut. Aut illo quo praesentium hic officia facere enim deserunt. Officiis sequi excepturi sed sunt magni. Eveniet doloremque repellendus voluptas.",https://beartnt-profile-photos.s3.us-east-2.amazonaws.com/beartnt+profile+photos/pexels-photo-220453.jpeg,72
Chad Skiles,February 2014,"Asperiores quae nulla omnis totam. Necessitatibus placeat adipisci ducimus harum sed aut esse. Sunt consectetur deserunt quia tenetur. Eos nesciunt ut et consequatur harum perspiciatis blanditiis molestiae excepturi. Dignissimos labore voluptas eius eos quidem quis dolor autem. Architecto maxime aliquam provident quis officia perspiciatis voluptates rerum esse.
 Quaerat nobis facilis et aut rerum reiciendis. Ea officiis animi et omnis. Deleniti doloribus consequuntur iste aut vel et blanditiis enim. Officia iste autem suscipit autem dolores. Qui est et ex optio nesciunt et nulla reprehenderit. Est reprehenderit natus sit inventore rerum adipisci accusantium dolorem explicabo.
 Minus eum excepturi et quidem nam et. Consequuntur fugit doloremque est. Aliquam molestiae vel id suscipit nesciunt. Iusto iusto ab numquam assumenda enim sunt omnis quia maxime. Ratione aut esse rerum.",https://beartnt-profile-photos.s3.us-east-2.amazonaws.com/beartnt+profile+photos/pexels-photo-4153618.jpeg,73
Kent Goyette,September 2009,"Ipsam corporis voluptatem atque autem aut repudiandae. Nam maiores voluptates ex molestias neque sunt. Perferendis ut qui incidunt eveniet est odio iusto.
 Fuga aut alias hic dolore vel. Ratione aut pariatur ea rem quia quo ea dignissimos. Magni iusto quia beatae quis adipisci cumque molestiae facilis.
 Ipsum corporis sunt dolorem soluta iste. Cupiditate nisi sunt voluptatem beatae voluptatem consectetur ratione modi debitis. Molestiae provident corrupti. Sapiente consequatur totam minima. Est repellat ut aut exercitationem. Aut quas itaque eos nulla dolores pariatur.",https://beartnt-profile-photos.s3.us-east-2.amazonaws.com/beartnt+profile+photos/pexels-photo-3851312.jpeg,73
Bernadette Cronin,April 2015,"Rerum aut et minima vel quisquam quas molestias eius. Qui aut vel et. Velit deserunt eligendi voluptas consequatur dolores enim qui. Molestiae consequatur aut dolorem voluptatem. Omnis earum saepe possimus quia voluptatem velit saepe. Rem minus sunt ex blanditiis reiciendis nulla.
 Consequatur qui fuga perferendis rem ipsum. Accusamus sed tempore dolores optio saepe molestiae est. Iusto eveniet sunt animi provident est voluptatum et quasi. Voluptatem et quae nam. Quas inventore labore magni et.
 Magnam et cum totam debitis ab nostrum. Tenetur aut veritatis. Maiores consequatur illo dolor. Sunt voluptatum aliquam maiores consequatur ea maxime sed. Eos exercitationem et molestiae. In quia quas quidem incidunt et unde sit accusamus.",https://beartnt-profile-photos.s3.us-east-2.amazonaws.com/beartnt+profile+photos/pexels-photo-4626351.jpeg,73
Gilberto Baumbach,May 2018,"Qui illo est omnis repudiandae. Velit aperiam alias perspiciatis provident facilis sed ex iusto. Ut eligendi sequi quia delectus dolore modi quia quia quia. Quasi corporis velit. Commodi et ullam sapiente laudantium deleniti.
 Commodi excepturi nostrum ut. Odit nihil temporibus iusto minus ut vitae totam. Fugiat laudantium illum error assumenda eaque. Quidem et aliquam. Officia doloribus natus.
 Possimus enim optio dolore saepe sint error numquam illum consequuntur. Eos rem beatae. Nobis omnis nam tempora hic id. Temporibus et explicabo. Hic ducimus et odio accusamus suscipit optio. Dolores neque sequi nostrum.",https://beartnt-profile-photos.s3.us-east-2.amazonaws.com/beartnt+profile+photos/pexels-photo-1484810.jpeg,73
Bethany Kertzmann,October 2011,"Vel dolores nemo repellat. Consequatur nobis in doloribus labore vel ex officiis blanditiis quas. Ducimus aut porro voluptatem quia enim autem eaque possimus est. Sunt laborum et quam laborum. Molestias iusto consequatur omnis nihil id delectus exercitationem.
 Explicabo quia aut. Non corrupti cum quisquam cupiditate nulla. Dolore numquam sit odit quia nihil aliquid tempora voluptatem autem. Dolores voluptatem optio fuga facere qui. Reiciendis ea quia voluptatem repellat dolores harum nobis.
 Perferendis est ea natus autem quo. Numquam animi quod et ratione itaque quos ipsam. Id voluptas quia maiores.",https://beartnt-profile-photos.s3.us-east-2.amazonaws.com/beartnt+profile+photos/pexels-photo-4886781.jpeg,73
Myron Gibson DVM,January 2014,"At necessitatibus velit facilis quia numquam ea voluptatem enim ad. Commodi eius quidem. Nisi omnis et ducimus sint animi cupiditate non eligendi sapiente. Sequi sit accusantium omnis laborum soluta tempora. Nostrum cupiditate et sequi. Est molestiae in rerum minima a.
 Ut dolorem voluptatem inventore adipisci optio. In at tenetur voluptatem sunt expedita nemo est est. Facilis aperiam est atque veniam laboriosam et. Beatae maxime ipsum aut architecto.
 Dicta amet et dolorum quo omnis officiis. Non vel qui quia dolorem et. Nemo quas ut quia officia optio illo qui voluptas. Quod saepe sequi eum voluptates vel dignissimos quos eos officia.",https://beartnt-profile-photos.s3.us-east-2.amazonaws.com/beartnt+profile+photos/pexels-photo-5853675.jpeg,73
Ms. Lynn Haag,February 2016,"Qui officiis id iste deserunt debitis ea ea. Quis neque voluptates harum non exercitationem. Quibusdam nisi voluptatem aut. Corrupti qui voluptatum. Eligendi quia recusandae corrupti eaque qui minus.
 Et omnis voluptatibus eligendi officiis fugiat. Fuga officiis qui ut repellat a. Voluptatem aut numquam nihil omnis et aut reprehenderit provident.
 Quos ut molestiae quasi voluptatibus voluptatem. Non minus aliquam. Sunt soluta eum sunt quas aut assumenda. Ipsam reprehenderit aut magnam.",https://beartnt-profile-photos.s3.us-east-2.amazonaws.com/beartnt+profile+photos/pexels-photo-2726111.jpeg,73
Shawn Durgan,February 2009,"Adipisci ut velit accusantium eos et et voluptatem alias. Voluptatem doloremque eum asperiores quaerat libero. Nostrum eligendi nobis optio molestiae facilis mollitia voluptatem earum. Voluptatibus illum consequatur ut et dolorem sint occaecati accusamus.
 Sed aperiam veniam cumque sint illo consectetur. Consequatur ut quam dolorem tenetur sed rerum. Voluptatum aut veritatis qui et totam aperiam. Totam doloremque dolor temporibus esse et iusto qui temporibus nam.
 Possimus soluta minus. Autem officiis ut. Eum occaecati voluptatem corrupti corrupti voluptatem. Voluptas reiciendis recusandae sequi magni. Laboriosam nulla et et non.",https://beartnt-profile-photos.s3.us-east-2.amazonaws.com/beartnt+profile+photos/pexels-photo-3770317.jpeg,73
Ernest Corwin,May 2020,"Numquam soluta dolorum. Qui id modi aliquam quod cum. Et esse cumque dolore. Eligendi saepe non ea vel vel.
 Accusantium ex quo et nihil minus quo sit. Consequatur in dolores fugit sint qui voluptatem in eius voluptatem. Nemo et consectetur est blanditiis nisi fugiat quos hic numquam. Ut sapiente voluptatibus molestias harum perferendis.
 Dicta id at quo et et est quae. At dolores natus. Quis nulla a.",https://beartnt-profile-photos.s3.us-east-2.amazonaws.com/beartnt+profile+photos/pexels-photo-4100670.jpeg,73
Enrique Heathcote,March 2010,"Rerum pariatur sed sed quis quasi nemo corrupti. Dolorum sed ipsum eaque quia. Eum non vel. Doloribus enim consequatur. Quis occaecati laudantium aut nulla at tempora. Est nam natus.
 Quam laborum velit. Sit quis quis modi repellat ab eum sunt eaque. A in voluptatem omnis rerum.
 Ut eveniet minus excepturi commodi tempore et quisquam sit. Non ea fugiat aliquid sed. Maxime est tempora odio tempora magnam repellendus odit adipisci.",https://beartnt-profile-photos.s3.us-east-2.amazonaws.com/beartnt+profile+photos/pexels-photo-3970387.jpeg,73
Irvin Williamson,March 2014,"Rerum fuga nisi accusamus sint quibusdam aut ullam laudantium perspiciatis. Occaecati molestias voluptate harum ipsum deleniti eum unde et. Et tempora non maxime impedit laudantium et quibusdam. Facere ea reiciendis.
 Aut magni vel excepturi aut et est ut maxime. Et ut et sed tempore velit. Harum quis ut aliquid doloremque molestiae molestiae tenetur. Qui expedita blanditiis. Ab facere quod.
 Similique voluptas commodi sapiente. Voluptatem velit enim optio. Quos aliquid occaecati sint quod eum necessitatibus aut esse.",https://beartnt-profile-photos.s3.us-east-2.amazonaws.com/beartnt+profile+photos/pexels-photo-220453.jpeg,73
Constance Rempel PhD,December 2015,"Hic nihil sit in atque. Officiis beatae repellendus qui at eum non et perspiciatis rerum. Quidem vel ut. Aut facere unde. Voluptatem molestiae commodi inventore. Quod doloribus sed tempora delectus qui et omnis.
 Tempore ipsa qui sit. Id est maxime ad numquam. Saepe dolorum veritatis ea dolorem qui. Esse eaque quo adipisci. Veniam repudiandae rerum.
 Velit maxime iusto excepturi facilis dolores. Blanditiis quia aut atque facere consequatur aspernatur at. Sit dolore ex autem molestias. Commodi voluptas tempore similique. Totam occaecati aut. Vel tenetur commodi et numquam reiciendis laudantium minus.",https://beartnt-profile-photos.s3.us-east-2.amazonaws.com/beartnt+profile+photos/pexels-photo-4100670.jpeg,74
Charles Koch,November 2011,"Facilis assumenda asperiores nisi molestiae hic animi quia in natus. Excepturi exercitationem placeat fugiat suscipit. Saepe quas quibusdam amet tempora ut distinctio. Laborum ratione voluptate voluptatibus ut.
 Ad esse consectetur iusto sint et. Placeat illo sint perferendis sint dolore molestias voluptatem molestiae. Sunt dignissimos nisi quae enim qui et ut quia. Dignissimos et qui. Iusto id numquam illo maiores.
 Inventore totam minus accusantium quos magni accusamus et explicabo. Nihil voluptates quod aut culpa repellat qui dolores odio hic. Nemo omnis impedit cum adipisci provident perferendis consequatur non neque. Sit molestiae iste sapiente in voluptate autem et. Blanditiis dolore perferendis cumque consequatur.",https://beartnt-profile-photos.s3.us-east-2.amazonaws.com/beartnt+profile+photos/pexels-photo-4886801.jpeg,74
Clayton Kessler,January 2020,"Ducimus quia nihil. Voluptatibus natus amet sunt explicabo sed. Aut sit alias qui iste sint.
 Quia nobis fuga sunt mollitia mollitia nesciunt. Sint sunt atque cum iure rem. Ea saepe iure illo aut et. Sunt sint beatae velit. Quia iste ex corrupti sunt recusandae velit consequatur. Odit harum odit facere est voluptatibus quaerat aliquam optio et.
 Enim ipsam soluta vel itaque quas ea repudiandae et. Recusandae ut quo omnis maxime fuga. Deserunt aut ut.",https://beartnt-profile-photos.s3.us-east-2.amazonaws.com/beartnt+profile+photos/pexels-photo-3770317.jpeg,74
Judy Effertz,June 2020,"Explicabo pariatur velit est tempora quia repudiandae. Maxime ut similique qui. Et id enim qui corporis distinctio consequatur et.
 In facilis assumenda quis facilis. Quia omnis qui perspiciatis itaque et optio cupiditate dolores. Sed provident aliquid iste a. Mollitia perferendis impedit vitae. Dolorum et exercitationem officiis a esse id totam nesciunt harum. Omnis odit cum sed est.
 Aspernatur consectetur quas vitae quae sit et. Et aliquid dolorem nemo aut amet nesciunt dolor ducimus. Expedita repellendus aliquam ea accusantium. Ut consequatur officiis quas ex non aut omnis repellat earum. Omnis velit non ipsam harum aut. Rem quam illo.",https://beartnt-profile-photos.s3.us-east-2.amazonaws.com/beartnt+profile+photos/pexels-photo-415829.jpeg,74
Darnell McDermott,November 2009,"Modi totam vel distinctio dolore. Suscipit esse dolorem quam deserunt fugit harum. Doloribus cupiditate est est et sunt quia. Aut rerum eum praesentium. Quis ullam rerum nostrum ducimus magni magni. Beatae mollitia dolores sed ullam corporis odio est eum quis.
 Qui consequatur sit consectetur rerum sunt et. Aut suscipit dignissimos vel ab soluta quisquam et blanditiis. Ut odio sed amet asperiores quas debitis non. Doloremque magni ullam quia molestias earum blanditiis illum aut. Commodi maiores qui ab id aut vel facilis omnis. At quod ratione cum voluptas.
 Ea vitae quo sed aliquid et impedit dolores earum. Et quasi doloremque natus. Odit totam voluptatem placeat qui aut iure nisi. Qui a dolorem ullam voluptatem modi sunt qui qui. Iusto sit cum perferendis.",https://beartnt-profile-photos.s3.us-east-2.amazonaws.com/beartnt+profile+photos/pexels-photo-4886781.jpeg,74
Antoinette Ernser,September 2018,"Ad voluptatibus doloribus enim sed quo rem. Voluptatem sit non et vel. Ipsam sequi voluptate et id.
 Et sit cumque et culpa veniam provident suscipit. Libero eius non. Ipsa in error animi voluptate nesciunt enim totam. Rerum natus debitis excepturi aut occaecati et libero.
 Ex dolor qui sed qui amet. Fuga alias eos voluptatibus dolorum illum magni. Eaque laborum quis. Nihil ipsam totam earum sed corrupti voluptatem rerum. At dignissimos quis iure expedita reiciendis id et.",https://beartnt-profile-photos.s3.us-east-2.amazonaws.com/beartnt+profile+photos/pexels-photo-3775540.jpeg,74
Miss Paulette Willms,October 2016,"Dolore quia voluptas eos nulla aut accusamus possimus sit ab. Placeat laborum blanditiis distinctio vitae nesciunt omnis eveniet. Assumenda enim tempore animi. Minus sunt non dolor. Molestiae et quis architecto sint optio autem aliquid dolorem magnam.
 Nisi et voluptas praesentium adipisci illum. Reprehenderit voluptatem nihil dolores et inventore. Ut dolor aut in nihil voluptatem est quae iste ut. Adipisci sit dolores architecto perspiciatis quia ut omnis. Atque officiis nulla sed aliquid aspernatur quod quia harum tenetur. Aut ab dolor et officiis.
 Qui nostrum distinctio id saepe enim explicabo animi. Qui quo officia perferendis inventore dolorem. Tenetur qui qui voluptas. Eius harum non ducimus ut tenetur nesciunt dolor ab.",https://beartnt-profile-photos.s3.us-east-2.amazonaws.com/beartnt+profile+photos/pexels-photo-2726111.jpeg,74
Derek Zboncak,July 2012,"Provident consequatur aut alias quae. Eos quod ipsam. Iure aut iure voluptas esse sapiente. Placeat hic aut aut voluptas ab voluptates et quia incidunt.
 Est nesciunt asperiores. Dolorum delectus odio. Expedita similique voluptates doloremque hic beatae. Et adipisci sit sint laboriosam vitae rem officiis quia. Et aliquam officia quas mollitia voluptatem ab ut quam. Ad alias natus sit nihil blanditiis est.
 Asperiores quae quia quidem. Quia reprehenderit iure aut qui non eos. Rerum magni nostrum velit debitis. Sequi consequatur ipsa voluptatem minus id et. Aut reiciendis repudiandae magni dolor atque deleniti molestias enim. Odio expedita repudiandae qui consequatur perspiciatis odio optio veniam consequatur.",https://beartnt-profile-photos.s3.us-east-2.amazonaws.com/beartnt+profile+photos/pexels-photo-4123910.jpeg,74
Wayne Bartoletti,September 2009,"Minima eos laudantium deserunt harum sunt sit ducimus. Odio dolor qui dolores nihil ad quas tempore. Repellat nostrum odit cum. Illo neque earum nihil aliquam eum in reprehenderit maxime.
 Quos a atque ut magnam. Illo porro neque voluptatum quis nam ut fugit. Enim omnis architecto quas. Id aut quo aut numquam odio qui aut. Magnam voluptas blanditiis vel quidem officiis accusamus molestiae.
 Rerum temporibus nihil. Eius et praesentium dolorum. Dolore distinctio consequuntur. Doloremque sapiente sunt delectus optio suscipit optio.",https://beartnt-profile-photos.s3.us-east-2.amazonaws.com/beartnt+profile+photos/pexels-photo-3851312.jpeg,74
