NAME,DATE,REVIEW_BODY,PROFILE_PIC,RATINGS_ID
Bradley O'Keefe,August 2017,"Aliquam commodi doloribus inventore repellendus aut. Voluptatem aut qui minus. Vel qui numquam et doloremque ullam explicabo molestias. Itaque magni ad aliquid voluptatibus sint molestiae.
 Unde aut eos optio et neque ut dolores cupiditate molestias. Quia ipsa sed dolore impedit vitae. Voluptatem odit voluptatum perferendis consequatur et. Voluptatem dolor omnis et. Est facilis animi excepturi nihil ut neque ut nostrum. Libero voluptatem hic vel nostrum ut sequi tempore esse est.
 A assumenda nesciunt ullam delectus. Et maiores rerum totam laboriosam eos minus. Itaque beatae corrupti est suscipit ducimus aut facilis. Deleniti excepturi saepe facilis repellat libero. Nihil earum eaque saepe rerum voluptas maxime asperiores perspiciatis. Sed culpa inventore consectetur ad iure et aut ullam qui.",https://beartnt-profile-photos.s3.us-east-2.amazonaws.com/beartnt+profile+photos/pexels-photo-1310522.jpeg,1
Salvador Cummerata Sr.,July 2017,"Ex voluptas et in vel fugit debitis nobis. Similique alias et ea earum aliquam rerum quo quis. Maiores error earum excepturi. Sint beatae corporis nemo voluptatem dignissimos. Molestiae adipisci quibusdam esse. Nesciunt magni excepturi.
 Eum non qui. Repellendus voluptatem et asperiores reiciendis autem et numquam assumenda blanditiis. Assumenda et ut ut aperiam quo. Numquam incidunt recusandae qui accusamus vel harum ex.
 Unde debitis et velit animi aut. Dolores ad eos est nesciunt soluta sit soluta. Ut non in temporibus. Est ipsa labore aut aut ut.",https://beartnt-profile-photos.s3.us-east-2.amazonaws.com/beartnt+profile+photos/pexels-photo-3770317.jpeg,1
Della Schowalter,May 2017,"Voluptas et doloremque mollitia. Atque blanditiis recusandae asperiores tenetur laudantium veniam ut. Voluptas sit quasi maxime et aut cupiditate harum minus nobis. Et vitae quo distinctio quia debitis officiis distinctio optio. Repellat reprehenderit a libero et.
 Molestiae optio minima praesentium doloribus laboriosam et. Labore delectus et voluptate molestias culpa ratione. Velit aut in in id quia laudantium nostrum a. Sequi placeat blanditiis delectus et voluptates possimus iusto vero dignissimos.
 Aut tenetur vitae eos similique. Officia nihil quo dolorum. Eum laboriosam ullam nihil. Dolores qui eligendi. Error accusantium vitae et illo dolorem.",https://beartnt-profile-photos.s3.us-east-2.amazonaws.com/beartnt+profile+photos/pexels-photo-1484810.jpeg,1
Monica Douglas,November 2017,"Quas nihil est laborum. In quaerat est dolorum excepturi. Reprehenderit quia iste mollitia maxime. Pariatur necessitatibus pariatur doloribus minus distinctio sit.
 Qui libero dolorum aliquam ut omnis quaerat. Inventore occaecati ut voluptas. Provident omnis quisquam sunt reprehenderit sapiente libero atque enim. Harum itaque aut quasi blanditiis nesciunt impedit consequatur expedita voluptatem. Aut quibusdam repellendus.
 Aut quidem sed qui ut ut maxime. Laborum sed libero sed sequi. Et atque et et et sint nulla voluptate sit dolorum. Aut inventore qui dolore.",https://beartnt-profile-photos.s3.us-east-2.amazonaws.com/beartnt+profile+photos/pexels-photo-4886781.jpeg,1
Evelyn Stracke,October 2013,"Est nihil vel accusamus laudantium dolores aut voluptas qui. Eligendi et quos facilis dolore enim commodi fugit quis quibusdam. Optio excepturi aperiam iure sint. Qui ut soluta nihil voluptatem placeat dicta.
 Quibusdam accusantium perspiciatis ut dolores repudiandae magnam. Ut sunt ab laborum. Sed corporis facilis aspernatur fugiat temporibus et illum cum. Ipsum illo assumenda sed. Delectus exercitationem est cum eos. Ad harum qui nihil voluptas.
 Velit a recusandae animi et saepe fuga quo. Pariatur repellat velit doloremque facere sed. Pariatur ut sint repellendus cumque voluptatem nam beatae voluptatum quo.",https://beartnt-profile-photos.s3.us-east-2.amazonaws.com/beartnt+profile+photos/pexels-photo-3970387.jpeg,1
Jasmine Emmerich,November 2016,"Qui recusandae est quos corrupti est sint. Consequatur enim maxime ut. Nihil impedit delectus temporibus et et voluptas sint eum. Saepe rerum odio nulla eos qui. Culpa expedita tenetur expedita ut in. Fuga quibusdam vel laboriosam eligendi rerum.
 Et libero impedit iusto quia molestiae aut pariatur. Temporibus harum id. Debitis nam doloribus debitis laboriosam ut veritatis mollitia. Quod facilis sint id beatae eaque neque voluptatem magni. Quis veniam tempore quibusdam sint maxime voluptates ratione nobis. Quisquam nihil enim omnis est.
 Ea doloribus suscipit earum quibusdam minima rem fugiat quaerat. Consequuntur dolores id qui provident excepturi nam. Dolorem architecto ex doloremque. Enim suscipit enim ab ipsa dolor odit. Molestiae dignissimos iste.",https://beartnt-profile-photos.s3.us-east-2.amazonaws.com/beartnt+profile+photos/pexels-photo-4153618.jpeg,1
Daryl Moore,February 2008,"Explicabo aperiam accusantium rem qui. Ad qui et. Sequi velit expedita voluptate autem corporis omnis ut sit. Alias dicta ratione perferendis sequi eum quis aut consequatur.
 Qui eaque tenetur dolore dolor recusandae ut. Eveniet voluptatem ipsam velit adipisci reiciendis unde nulla. Eos dolore vitae illum tempora autem in tenetur perferendis.
 Et non sit officiis quod et quis eius. Aliquam maiores non similique voluptas. Itaque perferendis ducimus expedita cupiditate quia eaque. Sunt autem sed quia suscipit adipisci quia voluptas sed. Assumenda aliquam quidem atque libero cumque consequatur quibusdam.",https://beartnt-profile-photos.s3.us-east-2.amazonaws.com/beartnt+profile+photos/pexels-photo-5853675.jpeg,1
Neal Rau,February 2008,"Sunt ipsa omnis voluptatem dolorum dolore sapiente. Quidem temporibus aut. Quo aspernatur accusantium dignissimos totam totam autem laboriosam.
 Et voluptatem sit aliquam nihil vero. Dolorem unde repellat fugit vero ipsa quos nostrum voluptatem quae. Qui facilis praesentium inventore omnis. Dolor sed consectetur quam occaecati sed quasi in porro. Aut dolorem asperiores porro soluta iure est sequi repellat.
 Voluptates sit dolorem error quisquam. Similique deserunt rem. Delectus iste voluptatem dolorem. Excepturi sunt placeat. Excepturi reiciendis quia delectus.",https://beartnt-profile-photos.s3.us-east-2.amazonaws.com/beartnt+profile+photos/pexels-photo-3775540.jpeg,1
Jan Goyette,April 2017,"Commodi in a sed voluptatem aspernatur qui. Quidem porro sunt qui. Ut doloribus officia. Est modi facilis dolor aut. Sint vel amet necessitatibus et sunt neque est dolore. At et neque natus quibusdam voluptatem.
 Officiis consequatur cum eligendi. Aliquam quaerat ab aut incidunt voluptas veniam unde. Eos sit et hic corrupti error non fugiat autem voluptas. Consequatur doloremque veniam ut eius.
 Quae ducimus omnis omnis facilis laboriosam. Nemo id mollitia assumenda iste. Vero at eveniet reiciendis qui voluptatem.",https://beartnt-profile-photos.s3.us-east-2.amazonaws.com/beartnt+profile+photos/pexels-photo-2726111.jpeg,1
Holly Dooley,August 2012,"Quia voluptatem a accusamus suscipit qui nobis distinctio tempore. Numquam omnis odio dolorem perferendis molestias explicabo et quia. Doloremque rem sed id consequatur velit temporibus dolor. Dolore sapiente natus et perspiciatis quibusdam iure occaecati minus.
 Consequatur et unde quae autem doloribus laborum maiores autem eligendi. Veniam molestiae autem similique aut. Dolor illum ipsam ullam ut laudantium porro nisi.
 Sint eos quis suscipit voluptatem ipsum ut dolor. Consequatur occaecati sequi ducimus dolorem totam. Ut adipisci corporis voluptatibus officia neque.",https://beartnt-profile-photos.s3.us-east-2.amazonaws.com/beartnt+profile+photos/pexels-photo-4123910.jpeg,1
Megan Gottlieb,October 2008,"Quia id magnam voluptas totam repudiandae quibusdam eveniet quia. Quisquam et soluta dolore tenetur. Sint alias blanditiis fugit rem qui cupiditate quidem. Dolores molestiae sapiente impedit consectetur tenetur soluta ratione explicabo.
 Quos accusamus blanditiis quisquam eum sed ad corrupti et consequuntur. Non ut dolorum labore error et sint nobis error. Dicta enim suscipit qui. Velit non debitis ea beatae.
 Maxime minima tempore sit corporis voluptatem placeat officia quisquam ratione. Reprehenderit dicta accusantium atque aut voluptas illo excepturi. Non debitis aut voluptatem exercitationem in quibusdam veritatis et necessitatibus. Et autem maxime odit et assumenda molestiae cupiditate. Temporibus impedit placeat velit.",https://beartnt-profile-photos.s3.us-east-2.amazonaws.com/beartnt+profile+photos/pexels-photo-220453.jpeg,1
Jesse Sanford,December 2014,"Esse minus sed accusantium est et repellendus. Quasi quidem itaque provident molestias laboriosam neque nihil et totam. Sequi veniam reiciendis consequuntur sit voluptas magni eius fugit.
 Ea fugiat non quisquam beatae dolorum tenetur possimus. Aut culpa libero officiis. Sint nostrum nulla veniam ad ea ut sit. Et sed ipsum sint. Porro aut facilis omnis iste repellat vitae ut. Quod aspernatur assumenda similique facere temporibus tenetur.
 Aut architecto hic eos. Velit sapiente doloribus deleniti minima voluptatibus. Alias qui dolorum quibusdam quo. Veniam molestiae et.",https://beartnt-profile-photos.s3.us-east-2.amazonaws.com/beartnt+profile+photos/pexels-photo-3770317.jpeg,2
Winifred Wuckert MD,August 2018,"Sunt alias officiis est voluptatem vero id. Illum ipsa cumque. Necessitatibus mollitia cum. Consequatur atque quaerat assumenda eos non. Quia et tenetur velit facere.
 Non natus iusto eum porro sit odit nesciunt sed. Nam earum et quo magni et molestiae. Aut quod consequatur et porro eos. Rem aperiam non.
 Iure impedit officiis aut aut esse quos. Possimus odio non quia ut dolor saepe. At inventore rem iure velit. Nisi at et dolorum quidem porro non aut ut. Dolor iste molestiae dolorum quia temporibus vitae quibusdam dolorum libero. Quo velit delectus nostrum consectetur molestiae at quo quia.",https://beartnt-profile-photos.s3.us-east-2.amazonaws.com/beartnt+profile+photos/pexels-photo-3851312.jpeg,2
Emmett McCullough,May 2017,"Sed possimus hic. Aliquid officiis laboriosam maiores. Enim ea quos nesciunt molestias perferendis.
 Ratione molestias voluptatem maiores deleniti. Harum laboriosam atque atque et esse non quia. Quos inventore dolores voluptatem est excepturi. Blanditiis ut sed.
 Occaecati sint explicabo delectus molestiae illo quia qui temporibus. Amet ipsum corrupti accusamus et repudiandae quibusdam. Aspernatur et sequi sunt qui pariatur soluta sit illo assumenda.",https://beartnt-profile-photos.s3.us-east-2.amazonaws.com/beartnt+profile+photos/pexels-photo-4153618.jpeg,2
Neal Bartoletti I,February 2019,"Sed sit omnis molestias quis. Aut minus sed. Commodi dolores molestiae in molestiae quibusdam quo impedit hic voluptatem.
 Et corrupti explicabo corporis necessitatibus. Consequatur sunt facilis molestiae. Aliquam quidem eius omnis nihil ab voluptas. Enim harum iusto. Et adipisci enim cumque ratione rerum laborum rem deleniti et. Facere ullam temporibus temporibus.
 Excepturi voluptatem est voluptatibus esse iste facilis amet. Sed ea nulla hic cum molestiae exercitationem et. Laborum aut dolorem et dolore sed id provident. Ea maxime reiciendis aliquam ut nesciunt reiciendis.",https://beartnt-profile-photos.s3.us-east-2.amazonaws.com/beartnt+profile+photos/pexels-photo-220453.jpeg,2
Mrs. Christie Hodkiewicz,July 2008,"Ea sint doloremque. Asperiores dolorem dolore occaecati. Eaque quibusdam hic ut ex et. Nemo nesciunt doloribus assumenda assumenda voluptas quo est harum. Eum ut dolorem quidem atque magnam deleniti. Aperiam illum sunt enim et voluptatem aut soluta dolorum.
 Hic fugit est et quasi. Dolorum rerum magni consequatur qui voluptatibus sequi ab voluptates. Aut excepturi quia eaque minima quo non nemo.
 Accusantium et impedit modi excepturi modi quisquam qui. Voluptas aut aut autem aliquid reiciendis maiores repellat odit. Praesentium eum voluptates accusantium ut ut et dolore. Velit beatae quis nemo tempora eos dolores culpa animi qui. Voluptas itaque autem doloremque at fugiat iusto ut sit dolorem. Ut quo ipsa sequi magnam aperiam aliquam dolores similique distinctio.",https://beartnt-profile-photos.s3.us-east-2.amazonaws.com/beartnt+profile+photos/pexels-photo-415829.jpeg,2
Spencer Hartmann,October 2012,"A odio vel debitis veritatis. Nisi expedita ad asperiores fugit cum et. Rerum qui ducimus similique aliquid et sed ad.
 Eos consequatur tenetur. Cum quis qui incidunt quasi. Natus fugit eum qui. Tenetur fugiat voluptas aut quisquam atque sunt eaque.
 Eos cum quo. Eos id voluptatibus veniam eos dolorem pariatur officiis omnis molestiae. Quas quis animi voluptas quam labore.",https://beartnt-profile-photos.s3.us-east-2.amazonaws.com/beartnt+profile+photos/pexels-photo-4886781.jpeg,2
Kim Ferry,May 2017,"Et fugiat harum eius neque repellat libero. Porro nobis sit fugiat fuga tempore. At ea est animi sed sequi similique.
 Similique non rerum. Impedit magnam et autem maiores corrupti voluptatem et dolores. Praesentium molestiae dignissimos perspiciatis voluptas aperiam doloremque facilis. Sunt inventore exercitationem minima quibusdam consequatur.
 Rerum recusandae deserunt rerum. Numquam saepe harum dolor illo laborum quas doloremque vel. Culpa sint necessitatibus. A et optio aliquid.",https://beartnt-profile-photos.s3.us-east-2.amazonaws.com/beartnt+profile+photos/pexels-photo-2726111.jpeg,3
Mr. Angela Nolan,May 2013,"Libero enim similique vel laborum. Ipsam quis et provident consectetur autem veniam molestias enim id. Cum officiis doloribus consequuntur optio quaerat recusandae.
 Qui ut voluptatibus repudiandae aut cum sunt non quisquam. Molestiae quia ad quisquam omnis. Quis dolores amet. Et praesentium minima sit harum.
 Quam porro iure. Omnis eveniet doloremque rerum et dolores nemo placeat molestiae tempora. In cupiditate error enim numquam. Error alias et quisquam ipsa eius accusantium ratione ipsum. Quia eum ut voluptas aut enim dolorum in. Quo fugit soluta adipisci quis nobis est earum.",https://beartnt-profile-photos.s3.us-east-2.amazonaws.com/beartnt+profile+photos/pexels-photo-3775540.jpeg,3
Julius Hettinger,October 2012,"Distinctio fugiat nobis. Nesciunt asperiores et hic voluptatem voluptatem. Quisquam a autem facilis id. Suscipit hic qui sed. Accusantium accusantium et. Minus esse inventore itaque velit est sint rem voluptatem harum.
 Ea quia earum ut ullam magnam iure nisi. Cumque id voluptas deleniti consequuntur quos quis. Architecto totam et et odio nihil sapiente.
 Quis nesciunt itaque accusantium. Aspernatur molestiae sint. Repudiandae doloremque et veniam veniam dolor eum omnis. Eveniet exercitationem saepe architecto perferendis odio perferendis veritatis iusto suscipit. Et ut aliquam deserunt illo laborum.",https://beartnt-profile-photos.s3.us-east-2.amazonaws.com/beartnt+profile+photos/pexels-photo-1484810.jpeg,3
Margaret McDermott,December 2018,"Tenetur quis mollitia expedita incidunt optio magnam ducimus ipsam aut. Dolor doloremque nihil excepturi voluptatem dolores quia recusandae. Eius voluptatem et amet eos sunt eligendi officia.
 Quo est consequatur possimus. Velit et ab nobis enim et et. Atque nobis nesciunt nihil voluptatem et est ex.
 Repellat quae quia totam ex earum excepturi. Voluptatum accusantium tempore eos aut quis dignissimos. Distinctio iusto nulla. Quod quae nam.",https://beartnt-profile-photos.s3.us-east-2.amazonaws.com/beartnt+profile+photos/pexels-photo-220453.jpeg,3
Ricardo Altenwerth,April 2009,"Aspernatur architecto rerum fugit veniam eos. Est eum atque dignissimos. Esse eveniet minima blanditiis enim eveniet tempore. Fugiat voluptatem asperiores. Rerum porro delectus quaerat. Aut accusantium sit delectus voluptate quas reprehenderit perferendis.
 Corrupti dolore ab magni tempora sunt id. Officiis deleniti omnis numquam tempora quis omnis nisi magnam cum. Magnam qui expedita pariatur. In doloremque sed.
 Laboriosam eveniet est fugiat temporibus voluptas nisi suscipit error. Molestiae dicta quam. Quis aperiam tempora qui unde consequatur. Aut et officiis consequuntur voluptatem dolorem et minus molestias. Neque quia et modi animi omnis error itaque. Ipsa dolorem molestiae.",https://beartnt-profile-photos.s3.us-east-2.amazonaws.com/beartnt+profile+photos/pexels-photo-4100670.jpeg,3
Raquel Veum,August 2011,"Odit dolore rerum velit optio consectetur officiis qui mollitia. Ullam quam neque perferendis dicta sit consequuntur ipsum voluptas. Quis quas qui enim architecto doloremque minima nesciunt. Et quidem dolorem asperiores reiciendis. Libero sapiente qui consectetur molestiae. Corrupti quis debitis qui sapiente facere eaque.
 Iusto molestias exercitationem architecto dicta placeat. Repellendus fugit nulla. Est qui iure enim dolores dolorem.
 Ut molestiae sit dolorem soluta commodi. Qui et expedita vitae tempora deleniti dolores ullam autem. Aliquid et inventore ut molestias. Asperiores incidunt sunt aut molestias explicabo incidunt qui dicta blanditiis. Autem laboriosam magni explicabo dolor quia quae nihil. Est dicta est aliquid quia excepturi aliquid.",https://beartnt-profile-photos.s3.us-east-2.amazonaws.com/beartnt+profile+photos/pexels-photo-5853675.jpeg,3
Reginald Stracke,February 2013,"Eum accusantium distinctio nostrum nobis fugit eum vel dicta. Cum magni facere vitae quia odit deserunt odio. Veniam omnis atque officiis voluptatem officia harum quas pariatur aut.
 Doloremque omnis odit expedita rerum tenetur possimus at esse hic. Quam laboriosam a delectus a reprehenderit enim soluta. Nihil ea reiciendis atque sint explicabo et sunt sapiente necessitatibus.
 Quo aut fuga odit eum aliquid itaque aut saepe et. Dolores consequatur velit eos ipsam. Sed impedit iste consectetur. Fugiat provident velit quis.",https://beartnt-profile-photos.s3.us-east-2.amazonaws.com/beartnt+profile+photos/pexels-photo-3970387.jpeg,3
Gretchen Metz IV,July 2015,"Non iste voluptas eaque est. Nostrum libero quia optio nemo nostrum odio. Blanditiis neque quia sed iste. Sequi placeat dolor dignissimos.
 Aut possimus nostrum rerum et sint nemo corrupti ut quo. Dolorum omnis ex commodi illum. Ex in quam et sed ut asperiores molestias illum voluptatem. Provident hic et eius perspiciatis consequatur modi.
 Quam explicabo sit quos et accusamus. Consequatur sed ut rerum nostrum sit. Voluptas delectus ut possimus ut perferendis. Qui eaque minus omnis distinctio est ea ratione odio eius. Et quo et fugit fugiat quidem aspernatur voluptatem.",https://beartnt-profile-photos.s3.us-east-2.amazonaws.com/beartnt+profile+photos/pexels-photo-4886781.jpeg,3
Dr. Eduardo Erdman,September 2009,"Deserunt suscipit quia saepe. Vero commodi suscipit consequatur veniam velit consectetur a. Neque nihil officiis nostrum dolorum. Expedita illo vel.
 Nesciunt tempora mollitia commodi fuga praesentium fugiat facilis veritatis. Sed provident voluptatum et aut reiciendis quibusdam est quasi. Est debitis dignissimos quia qui dignissimos et.
 Soluta consequuntur ipsam aut. Nesciunt dolorum delectus enim aut. Molestias molestiae deleniti quae quidem quia provident amet ea voluptate.",https://beartnt-profile-photos.s3.us-east-2.amazonaws.com/beartnt+profile+photos/pexels-photo-4626351.jpeg,3
Orville Stokes,May 2013,"Non animi ipsam commodi non soluta rerum aspernatur unde. Optio id accusantium nulla sunt magni. Debitis eos architecto et et beatae molestiae aut quis sapiente. Illo eveniet sit mollitia aperiam ipsa totam veritatis quia dolores.
 Minima aut aut asperiores quis laudantium corporis aliquam assumenda. Ratione fugit occaecati. Minima animi voluptatem nostrum accusamus quo nisi qui. Ea rerum sapiente nihil animi soluta quia dolorum saepe. Enim corporis id non ex nemo quibusdam omnis qui et.
 Velit ad qui itaque cumque et. Pariatur aut architecto dolores consequuntur. Quo omnis expedita quidem et aut illo magnam. Ut dolorum amet. Facilis laboriosam occaecati quo. Hic qui eligendi vel deserunt occaecati adipisci.",https://beartnt-profile-photos.s3.us-east-2.amazonaws.com/beartnt+profile+photos/pexels-photo-4153618.jpeg,4
Antonia Shanahan,January 2017,"Nihil ut quis voluptatem voluptates. Quia qui perferendis ipsum blanditiis fugiat consectetur aliquid. Illum quae et aliquam voluptates error nihil laboriosam nesciunt. Consequatur dolore nostrum est temporibus. Nisi maiores dolorum. Libero rerum magni nostrum.
 Amet maxime consequatur nesciunt distinctio. Inventore et odio quod sunt aliquam. Nihil iusto tenetur fugit aliquid amet. Expedita molestiae repellendus alias sapiente. Corrupti voluptate reiciendis consequatur illo atque et ut aliquid quaerat.
 Dolorum magnam est. Excepturi vel dolorem illum porro quas itaque sunt placeat. Tenetur cumque est libero neque corrupti omnis sapiente nostrum ut.",https://beartnt-profile-photos.s3.us-east-2.amazonaws.com/beartnt+profile+photos/pexels-photo-2726111.jpeg,4
Laverne Kuhic,November 2010,"Eligendi sit neque inventore illo odio enim. Dignissimos saepe autem et nesciunt consequatur et sunt. Enim sed at eveniet enim repellendus laborum recusandae consequatur.
 Earum quasi sunt explicabo animi vitae. Id quo est aut sunt consequuntur et aliquam ut. Impedit ut sit laudantium aliquam ut voluptatem eaque.
 Sit laborum pariatur illum sint. Quasi vero amet magnam quaerat sed est suscipit. Aut optio nemo non. Quae inventore praesentium consequatur saepe quidem rerum nisi sequi.",https://beartnt-profile-photos.s3.us-east-2.amazonaws.com/beartnt+profile+photos/pexels-photo-4123910.jpeg,4
Shannon Daugherty,February 2020,"Reprehenderit eum ut repellendus at reprehenderit ut sit quia est. A quas similique veritatis pariatur aspernatur dolor voluptas eveniet. Maxime corrupti odio nemo eos.
 Et molestias non. Aliquam nam perspiciatis necessitatibus non in. Reiciendis nostrum ab est sunt.
 Atque sunt et. Error recusandae explicabo quia assumenda voluptatem eum quod. Explicabo necessitatibus voluptatem dicta vel in maiores vero culpa.",https://beartnt-profile-photos.s3.us-east-2.amazonaws.com/beartnt+profile+photos/pexels-photo-1484810.jpeg,4
Rhonda Stark,December 2018,"Non deleniti repellat odio et animi totam atque. Sed omnis nesciunt praesentium accusantium libero tempore quae. Repudiandae mollitia doloribus laboriosam modi est laborum. Sit assumenda vel quis sed qui praesentium repellendus facere excepturi. In iste officiis dolor eius minus iure eius qui. Nulla vero voluptatem.
 Culpa earum et. Dolorum sed molestiae a qui autem veniam. Eum ex vitae odio et voluptatem et sunt tempora sequi.
 Qui reiciendis molestiae at modi aut quibusdam. Quis at voluptates occaecati incidunt est numquam molestias rerum repellat. Eos atque quia.",https://beartnt-profile-photos.s3.us-east-2.amazonaws.com/beartnt+profile+photos/pexels-photo-4100670.jpeg,4
Mrs. Norma Boyle,July 2011,"Quaerat excepturi quibusdam unde voluptas deleniti. Natus unde in fugiat sed nihil voluptatibus voluptate iure est. Eligendi incidunt perferendis similique corporis placeat culpa ut sunt. Cum fugiat nesciunt.
 Esse saepe et quas ea. Et in impedit magni quisquam pariatur nihil quae. Voluptas labore et explicabo repudiandae. Ut voluptates et. Rerum consequatur nesciunt autem nisi aut ut.
 Qui autem autem voluptatem accusantium illo nostrum dolores sit dolore. Distinctio officia temporibus itaque aut ut porro officia vero. Cupiditate velit ea reprehenderit et natus rerum a. Officiis sunt molestias rerum qui in fugit est perferendis. Dolorem vitae sit perspiciatis ratione dolorem sit. Voluptates officia enim ut iusto non atque.",https://beartnt-profile-photos.s3.us-east-2.amazonaws.com/beartnt+profile+photos/pexels-photo-3770317.jpeg,4
Bernard Wolf,April 2017,"Pariatur sunt vel optio quia ut modi. Recusandae deleniti nam tenetur sed. Rerum voluptate omnis et ut. Ea voluptatibus rerum est est.
 Quam sed sed harum labore quia rem atque consequatur minima. Dolorem perspiciatis eius odit tenetur molestiae consectetur consequatur. Aliquid autem porro non repellat ullam est molestiae animi.
 A et fugit. Temporibus quibusdam et sed. Magni est inventore autem commodi aut ipsa voluptatum.",https://beartnt-profile-photos.s3.us-east-2.amazonaws.com/beartnt+profile+photos/pexels-photo-4886781.jpeg,4
Victor Trantow,March 2017,"Accusamus consectetur ab. Fugit quis expedita quia repellat. Deleniti et alias officia neque. Officia eos voluptas corrupti non cum sed.
 Explicabo vero provident pariatur ab ut atque. Totam corporis est ducimus ratione ut aut. Fugiat aliquid voluptatem ab iste voluptas.
 Magnam quae fugit. Ipsum id culpa. Saepe velit sequi dicta voluptatem dolore velit est. Assumenda odit maxime soluta saepe alias pariatur aut ut.",https://beartnt-profile-photos.s3.us-east-2.amazonaws.com/beartnt+profile+photos/pexels-photo-3970387.jpeg,4
Frederick Bednar,November 2018,"Sequi cumque atque ut praesentium. Et ea beatae. Et quas quibusdam qui aliquam. Ipsa consequatur provident at nobis. Ipsa veritatis et quasi veniam aut. Officiis voluptatum necessitatibus molestiae amet fugit autem unde.
 Aut nihil est et eos dolores. Consequuntur sed mollitia tempore corrupti. Omnis mollitia et asperiores sed autem error accusamus. Aut eum alias doloribus laborum quo. Qui incidunt doloremque.
 Excepturi ut maiores harum illum. Est alias ratione odit alias natus et. Deserunt corporis vel quia voluptatem. Tempore alias vel aspernatur placeat porro eum et nesciunt. Dolor quia velit quod eos itaque. Voluptatibus quaerat esse totam.",https://beartnt-profile-photos.s3.us-east-2.amazonaws.com/beartnt+profile+photos/pexels-photo-415829.jpeg,4
