NAME,DATE,REVIEW_BODY,PROFILE_PIC,RATINGS_ID
Rodolfo Ortiz,April 2013,"Cum sapiente occaecati officiis ex fugit facere reiciendis. Qui et sit aperiam et expedita non dolorem. Nihil iure voluptatem consequatur dolore distinctio eius et quasi. Eos qui sed voluptates aperiam veritatis. Quia provident voluptas quo. Laboriosam rerum eius tenetur.
 Perferendis ducimus reiciendis. Reprehenderit et et qui soluta. Voluptate aut fugit nulla quo sit qui officiis. Velit nihil totam quia. Vero quas velit et et inventore.
 Iusto et aut. Ut qui voluptatem qui ut consequatur quis vero voluptates. Qui officia quidem in quis omnis cum. Doloribus non est distinctio aut. Atque assumenda voluptatem aut.",https://beartnt-profile-photos.s3.us-east-2.amazonaws.com/beartnt+profile+photos/pexels-photo-220453.jpeg,22
Earl Lehner,December 2020,"Voluptas qui ut soluta sed. Qui hic nulla quod nostrum. Totam neque ex doloribus voluptatem rerum. Dignissimos libero sunt vel ut quibusdam quibusdam non assumenda sapiente.
 Atque occaecati necessitatibus non omnis omnis delectus vero omnis at. Fuga et voluptatem quod facere labore quo debitis sit qui. Dolores consequatur eius ut rerum esse quidem quaerat. Voluptatibus sint est quidem. Dolore et deserunt assumenda asperiores illum voluptatem quam optio. Perferendis vel non rerum ut vero quisquam necessitatibus.
 Neque officiis enim tenetur cum. Dolores perspiciatis quia ut laudantium possimus voluptatibus amet sequi. Consequatur enim earum fuga ad incidunt nisi voluptate eveniet. Est rerum voluptates saepe aut perspiciatis qui nam error in. Officiis ab atque saepe molestias aut asperiores similique.",https://beartnt-profile-photos.s3.us-east-2.amazonaws.com/beartnt+profile+photos/pexels-photo-1310522.jpeg,22
Herbert Hane,October 2019,"Voluptas quibusdam explicabo. Ratione illum eos at voluptates inventore. Incidunt animi vitae ullam laudantium molestias quis vitae porro.
 Quis ut aut. Iste quod nemo velit enim et ipsum cupiditate. Corporis aut dolore. Delectus aut voluptatem necessitatibus error accusantium autem minima aliquam voluptates. Eum consectetur consequatur et sunt vitae quam sequi dolorum fugiat.
 Accusamus consequuntur voluptatibus. Suscipit quae esse rem non et esse aliquid. Vitae eaque recusandae omnis perferendis officia totam. Illum id recusandae nihil praesentium eum.",https://beartnt-profile-photos.s3.us-east-2.amazonaws.com/beartnt+profile+photos/pexels-photo-4123910.jpeg,23
Esther Hackett,April 2020,"Illum laborum dicta dolorem sed reprehenderit excepturi aspernatur saepe. Ab nihil eius. Placeat consequatur facere placeat quos fuga blanditiis. Deserunt hic autem asperiores blanditiis veniam eos nesciunt in ducimus.
 Eaque alias sint itaque labore delectus. Eos qui sint atque odio quia laborum quidem quisquam. Dolores praesentium placeat quas et laboriosam exercitationem delectus quia incidunt. Esse iure vero.
 Deleniti id recusandae cupiditate laudantium accusantium sapiente qui. Optio consequatur molestiae explicabo repellendus aliquid. Eum eum quia ipsam voluptas. Odit illo odit alias eaque sapiente.",https://beartnt-profile-photos.s3.us-east-2.amazonaws.com/beartnt+profile+photos/pexels-photo-4100670.jpeg,23
Irma O'Kon PhD,May 2019,"Aut quis numquam voluptatibus sequi error sit earum. Laudantium sit mollitia. Praesentium ut non deserunt hic suscipit architecto.
 Veritatis non repudiandae amet in quaerat iste. Molestias sint molestiae. Dolore nesciunt optio velit officia neque. Hic animi beatae. Est et facilis culpa voluptatem. Et voluptatum quo deleniti occaecati et quasi.
 Quis aliquid amet laudantium laborum velit eos minima. Officia rerum sit voluptas occaecati. Quae perspiciatis rerum aspernatur. Numquam et qui voluptatem consequatur id et qui.",https://beartnt-profile-photos.s3.us-east-2.amazonaws.com/beartnt+profile+photos/pexels-photo-4886781.jpeg,23
Rufus Spinka DDS,April 2013,"Consequatur nihil non a voluptas consequatur consequatur. Nostrum ut similique sint qui officiis assumenda. Cumque ratione vel neque qui.
 Consequatur similique est magnam omnis dolore nulla voluptatem. Ab consequatur illo consequuntur voluptatibus provident quaerat sit repudiandae. Vero est illum.
 Iure ducimus earum explicabo harum quis quidem voluptatum impedit voluptatem. Atque voluptas alias totam maiores nisi. Culpa saepe molestiae voluptatem qui. Autem quia qui. Non sapiente laboriosam eos suscipit rerum repellat sunt.",https://beartnt-profile-photos.s3.us-east-2.amazonaws.com/beartnt+profile+photos/pexels-photo-4153618.jpeg,23
Spencer Kunze,March 2019,"Repudiandae consequatur delectus enim impedit quis rerum. Temporibus quia amet provident veniam veniam voluptatum ea. Sunt et vero. Aliquid debitis id. Magnam esse necessitatibus delectus minus pariatur molestias aliquid.
 Et eum rerum ex voluptas voluptatem debitis harum impedit et. Aut nihil adipisci culpa. Ut omnis non est quam. Aut amet sed.
 Quos aut est nihil accusantium facilis et sapiente et. Est qui et et. Ipsam maiores in porro magni eius qui quod. Voluptatibus odio laudantium est eum porro tempora quisquam vitae.",https://beartnt-profile-photos.s3.us-east-2.amazonaws.com/beartnt+profile+photos/pexels-photo-415829.jpeg,23
Hugh Bernhard,February 2012,"Velit provident quam sit quo non laboriosam. Ex tempore labore qui quas dicta dolor. Et ipsa ipsum. Eum similique culpa et. Occaecati neque voluptatem quod corrupti iusto ea vero. Dolorum facere doloremque consequatur soluta corrupti quod ipsum.
 Nobis explicabo nesciunt ipsa quaerat dolore. Animi maiores consequatur itaque voluptas ad. Placeat voluptate aspernatur est et occaecati adipisci deserunt.
 Iusto dicta ut. Molestiae facere nihil. Asperiores laudantium veniam repellat inventore. Est vel eligendi illum magni possimus id tenetur.",https://beartnt-profile-photos.s3.us-east-2.amazonaws.com/beartnt+profile+photos/pexels-photo-3775540.jpeg,23
Francisco Murphy Jr.,May 2016,"Laborum ea id similique ex facilis veniam. Id ut est dolores dolores porro. Dolores ea repellat aut quia qui.
 Tempore sint eos sunt dolorum est et. Eos laboriosam quis delectus voluptatum odio. Ad id sequi doloribus ut explicabo vitae fugiat. Et quisquam ipsa dolores rem magni eum tempore itaque et.
 Omnis nihil quia eius natus earum. Necessitatibus hic corrupti molestiae inventore. Iure vitae voluptates eos ipsam et sint rerum porro. Dolor ipsam ex veniam laudantium.",https://beartnt-profile-photos.s3.us-east-2.amazonaws.com/beartnt+profile+photos/pexels-photo-3970387.jpeg,23
Minnie Sporer DDS,July 2014,"Perspiciatis inventore repudiandae tempore placeat ut mollitia ut. Maxime facere officiis qui explicabo culpa. Repellat corrupti molestiae aut commodi possimus blanditiis. Repellat maxime officia ullam quo labore culpa est et nobis. Quia autem quod ut autem eos animi dolor at nam. Et officia id similique assumenda quaerat tempore dolores rerum ullam.
 Beatae numquam dolor molestiae aut quas corporis non. Facere magnam minima cupiditate non ipsa quibusdam. Quis molestias ad quaerat ut doloribus autem placeat autem nemo. Incidunt necessitatibus quis sed soluta earum molestiae. Eveniet excepturi ut nam.
 Repellendus ex assumenda ab magnam in. Ducimus ut sunt animi voluptates earum qui. Iusto repellendus dolorem in porro sed voluptas cum. Soluta ut officia ut dignissimos quas omnis inventore architecto.",https://beartnt-profile-photos.s3.us-east-2.amazonaws.com/beartnt+profile+photos/pexels-photo-3851312.jpeg,23
Terrence Bartoletti III,February 2011,"Et molestiae velit. Adipisci ea et tempore temporibus. Vel omnis sint repellendus voluptatem odit nihil sint dignissimos vitae. Repellendus illum animi molestiae expedita totam praesentium. Sunt sed porro minima autem dolorem quis. Nesciunt nobis fugiat reprehenderit ut omnis.
 Dolores a non illo architecto sapiente quas sint aspernatur maxime. Nulla minima facere id. Quibusdam molestiae voluptates eum non itaque. Vitae repellendus velit maiores.
 Et provident fuga dolor sed quos adipisci. A consequuntur qui quia id adipisci. Nihil rerum et neque. Incidunt quo repellendus. Corporis soluta cumque eum cum deleniti velit. Sequi accusamus eos similique fugit dolores non quidem ex culpa.",https://beartnt-profile-photos.s3.us-east-2.amazonaws.com/beartnt+profile+photos/pexels-photo-3770317.jpeg,23
Meghan Wehner,March 2016,"Qui laboriosam quam deleniti animi velit possimus. Sit dolor facilis. Sapiente velit sed et et explicabo ut consequuntur. Sed est voluptate et iste fuga sit aliquam impedit. Est voluptatibus nostrum molestias aliquam fugiat mollitia eligendi quia.
 Aut porro reprehenderit provident dolores non voluptas consectetur. Maiores vero maiores quia. Tenetur et beatae culpa exercitationem quibusdam natus ea. Alias occaecati harum qui aut facere.
 Sit corrupti ipsam ea in in dignissimos. Maiores sit sed dolor at maiores dolor iure. Voluptatem officia eos vitae unde voluptatem rerum voluptas. Officia corrupti et ad itaque id consequatur maxime fugit corrupti. Nemo et earum sed ipsum eum.",https://beartnt-profile-photos.s3.us-east-2.amazonaws.com/beartnt+profile+photos/pexels-photo-4626351.jpeg,23
Faye Mayer,April 2020,"Expedita illum accusantium. Et explicabo nam dicta. Laborum nulla fuga sint quas neque. In et amet quasi molestiae. Vel omnis sed illum et. Rem autem amet laudantium consectetur.
 Sit sit quisquam et. Rerum est quaerat. Consequatur vero non. Provident sed delectus consequatur. Architecto voluptate eius.
 Id consequatur odit quisquam enim dolores. Sapiente adipisci voluptatem eaque aperiam modi non. In necessitatibus inventore natus soluta in sunt eveniet. Quo et earum error quia animi sit reiciendis distinctio. Et velit aperiam adipisci laudantium et aut et odit aut.",https://beartnt-profile-photos.s3.us-east-2.amazonaws.com/beartnt+profile+photos/pexels-photo-4886801.jpeg,23
Manuel Gerlach,September 2008,"Impedit iusto suscipit voluptate enim autem sit est qui ad. Officia commodi perferendis aut quia dicta eaque. Dolores illum sit. Tenetur nemo sequi id voluptas numquam est voluptatem quidem.
 Aut amet quia debitis. Aut asperiores quidem aspernatur nisi quod temporibus corporis perspiciatis. Non harum qui in nulla rem. Enim rerum ea alias. Labore numquam quia et esse. Ad natus aut rerum.
 Minus sunt eaque dolore. Et pariatur nemo veritatis quaerat iste accusantium est. Maiores repudiandae qui autem aliquam voluptas sequi quae. Ipsa atque distinctio molestias quasi vitae vel laudantium repellat.",https://beartnt-profile-photos.s3.us-east-2.amazonaws.com/beartnt+profile+photos/pexels-photo-2726111.jpeg,23
Rosemary Kreiger,June 2016,"Veniam consequatur aut omnis tempora aliquam voluptates quo. Nisi incidunt dolor assumenda ut sequi consequatur doloremque provident. Error qui id. Sed earum officiis dolorum aut suscipit est a consequuntur. Quidem unde eveniet vitae repellat rerum ut et.
 Voluptatibus qui aspernatur itaque ipsum quia veniam. Facilis atque distinctio et incidunt rem. Quia debitis doloremque accusamus quia sed omnis libero ea accusamus. Omnis occaecati qui voluptas velit eum. Qui nostrum aut nobis qui error repellat maxime ipsum.
 Voluptatum ut placeat et eos ducimus dolorem voluptatem. Quo nisi est dignissimos fugit expedita eum. Nam quaerat repudiandae qui qui nulla ex in inventore reprehenderit. Eaque sit est sunt et quam omnis. Dolore voluptatem rerum quod.",https://beartnt-profile-photos.s3.us-east-2.amazonaws.com/beartnt+profile+photos/pexels-photo-1310522.jpeg,23
Mrs. Gayle Hayes,July 2008,"Libero unde deleniti maxime quis ducimus ipsa temporibus velit quam. Cupiditate est ad ea veritatis quod. Esse qui voluptate velit ea reiciendis provident mollitia iure. Provident aspernatur ab qui.
 Natus deserunt molestias inventore. Sit maxime autem sint. Rerum fuga id amet maiores animi.
 Voluptas rerum qui voluptatem laborum quasi soluta rerum. Sit rerum rerum quod maiores accusamus voluptas. Expedita est minus occaecati quaerat. Blanditiis deleniti incidunt repellendus exercitationem fugiat animi dolores. Animi alias quisquam sed.",https://beartnt-profile-photos.s3.us-east-2.amazonaws.com/beartnt+profile+photos/pexels-photo-1484810.jpeg,23
Neil Hodkiewicz,August 2015,"Quisquam saepe provident dolor. Possimus ut repellendus nesciunt qui itaque. Non iusto libero consequatur possimus eius quia id. Beatae voluptatum alias.
 Voluptas est fugit necessitatibus. Tempore quia rem necessitatibus earum amet. Voluptas voluptas recusandae rerum qui consequuntur et. Eos voluptas cupiditate quibusdam perferendis perferendis. Omnis rerum aut. Doloremque necessitatibus eum.
 Aut vel architecto sed. Fugiat totam et saepe error amet sit eos qui velit. Deserunt delectus facilis. Autem totam aspernatur nostrum delectus.",https://beartnt-profile-photos.s3.us-east-2.amazonaws.com/beartnt+profile+photos/pexels-photo-220453.jpeg,23
Jill Beahan,June 2018,"Voluptatem amet dicta aliquam quia. Officiis et maxime sint rerum itaque voluptatem. Minus aspernatur sapiente et dolore laboriosam ipsam enim. Expedita sapiente accusantium neque deleniti rem ratione sit dolorem labore.
 Modi animi enim quis. Repellat officia repellat repudiandae dolorem quisquam dolorum in quibusdam pariatur. Et dolorum cupiditate cumque sint distinctio quibusdam et. Rerum dolorem laudantium odit omnis non et. Quia possimus neque. Nulla laudantium nam pariatur voluptas aliquid vel quis consequatur aut.
 Quidem sed sit commodi quos et quod sit dolor. In dolor aliquid quis perspiciatis nihil sit quia aut modi. Voluptas qui ut consectetur est animi.",https://beartnt-profile-photos.s3.us-east-2.amazonaws.com/beartnt+profile+photos/pexels-photo-1484810.jpeg,24
Miss Bob Schultz,September 2012,"Iusto sed excepturi rerum est tempora sit assumenda. Exercitationem rerum sit in illum molestiae repudiandae aut quis. Nulla et sapiente odio iste id. Voluptates nesciunt reiciendis tempora neque ducimus natus ipsam enim. Sunt voluptates inventore quidem placeat adipisci. Nulla quibusdam ullam qui ipsa consequatur itaque.
 Fugit unde laudantium nemo totam voluptates et aut similique. Voluptas magni assumenda accusantium tempora ut sit. Quas omnis facere quae. Officiis iure nostrum quisquam ut ex rerum amet quos. Illum quos explicabo. Vel iure dolores quia est veritatis hic.
 Cumque sed in veritatis eveniet ipsa ipsa voluptatibus in. Qui magnam eaque est atque beatae nihil. Quo et quo assumenda porro molestias ad. Expedita adipisci non excepturi nihil temporibus magni impedit ad exercitationem. Aut et eligendi sunt veritatis qui perspiciatis.",https://beartnt-profile-photos.s3.us-east-2.amazonaws.com/beartnt+profile+photos/pexels-photo-2726111.jpeg,24
Roxanne Wintheiser,January 2018,"Aut iste enim eaque tempora ut neque. Molestiae aliquam mollitia et aut harum. Iste minus quis sunt qui.
 Sequi cum esse laborum dolores itaque eum mollitia repudiandae odit. Alias et quaerat aperiam. Numquam corporis itaque sint. Dignissimos necessitatibus sit doloribus soluta. Voluptatem odio itaque earum repudiandae ut porro. Rerum quia accusamus cum.
 Numquam est quibusdam. Distinctio aut nulla aut accusamus pariatur reiciendis suscipit eveniet vel. Molestiae repudiandae nobis repudiandae est id et id minus ab. Praesentium ducimus assumenda minus ipsa ad velit voluptas et. Omnis molestiae similique harum. Quia labore similique harum.",https://beartnt-profile-photos.s3.us-east-2.amazonaws.com/beartnt+profile+photos/pexels-photo-220453.jpeg,24
Shelia Wiza I,May 2011,"Numquam ipsum suscipit odio iste sit neque earum neque. Quod vel sed aliquid et consectetur incidunt aut voluptatum. Aut aut et recusandae soluta. Similique distinctio aut et quos asperiores sed debitis. Eos doloribus dolore aut odio sed ea at et sequi. Molestiae et quas.
 Quaerat qui et aperiam aut incidunt. Sint et atque sed ea ipsam possimus. Optio commodi ut voluptatem quae omnis ipsum. Quas est non. Ex maiores necessitatibus. Aut asperiores et aut iusto.
 Laboriosam autem non enim suscipit sit et accusamus at culpa. Asperiores harum id sunt voluptatibus. Est velit quia. Adipisci ut deleniti alias esse. Nihil provident sapiente rerum aut corrupti aut debitis.",https://beartnt-profile-photos.s3.us-east-2.amazonaws.com/beartnt+profile+photos/pexels-photo-415829.jpeg,24
Wilbur Renner,August 2017,"Provident nesciunt ea cumque amet molestiae molestiae rem. Sint dolore perspiciatis repellat saepe. Voluptas consequatur ut rerum. At aut quasi et voluptate ducimus tenetur velit eligendi. In molestiae quae.
 Eos ratione praesentium reprehenderit non cupiditate reprehenderit dolores omnis. Id repellendus tempore earum magnam. Maiores rerum quia assumenda voluptatibus dicta animi et earum possimus. Corporis accusamus inventore nulla doloribus repellat accusantium harum saepe corrupti.
 Non occaecati aut debitis saepe recusandae et eos. Eaque itaque at. Natus dolor consequatur deserunt eaque.",https://beartnt-profile-photos.s3.us-east-2.amazonaws.com/beartnt+profile+photos/pexels-photo-5853675.jpeg,24
Miss Hazel Waters,August 2015,"Repudiandae aliquam vel. Voluptates consequatur tempora. Molestiae cum temporibus nulla possimus porro. At tempore sit minima omnis quo provident. Est quisquam non consequatur quaerat sit.
 Dolor quia adipisci. Aliquam sit fugiat quis sed. Reiciendis et rem excepturi similique illo dignissimos eum. Ut commodi iusto maxime magnam. Laudantium et commodi velit.
 Perspiciatis asperiores adipisci cum inventore eligendi. Voluptas eos qui delectus. Quis dolores perspiciatis necessitatibus consectetur occaecati et.",https://beartnt-profile-photos.s3.us-east-2.amazonaws.com/beartnt+profile+photos/pexels-photo-4886781.jpeg,24
Christina Parisian,October 2016,"Numquam minus cum fugit totam expedita ipsam et. Non laudantium ad quis id est reprehenderit laudantium. Nostrum ut debitis nobis facere placeat voluptate ullam qui ut. Modi nobis alias expedita doloribus dolor corrupti totam. Repudiandae assumenda velit labore culpa dolores in. Numquam minima expedita optio rem sed placeat.
 Aliquam soluta quas possimus quisquam. Accusamus nobis ullam eos quo et. Et nostrum dicta neque distinctio quasi repellendus sit. Qui doloribus vitae consequatur cupiditate doloribus. Quis dolore dolor veritatis.
 Non atque rem ea tempore officiis et voluptas et. Animi velit reiciendis aperiam sunt facere molestiae voluptatem quia. Ut libero quae explicabo nihil eos aut omnis quo. Reprehenderit quibusdam doloremque dolor labore recusandae est. Expedita odio praesentium labore et. Et ut porro provident.",https://beartnt-profile-photos.s3.us-east-2.amazonaws.com/beartnt+profile+photos/pexels-photo-2726111.jpeg,25
Patsy Spencer,March 2015,"Sed inventore eum velit et tenetur. Doloribus molestiae voluptate itaque ut magnam minima ut. Similique tempora qui. Soluta explicabo dolores repellat perspiciatis temporibus dolorum sapiente nemo enim. Animi provident deserunt iste aut eos accusantium.
 Quae eveniet id aut quod. Mollitia aut sed. Asperiores reprehenderit atque labore possimus. Molestias iste non accusamus. Consequatur porro quis nostrum aliquam a quasi rerum. Enim quis aut officiis.
 In ut optio ab accusamus sunt quod. Est blanditiis dolor at illo necessitatibus. Nobis animi vitae et tempore placeat hic qui fugit culpa. Ut qui cupiditate qui saepe velit. Omnis sint aspernatur dignissimos odit adipisci eos nostrum minus optio. Voluptas quae enim eveniet.",https://beartnt-profile-photos.s3.us-east-2.amazonaws.com/beartnt+profile+photos/pexels-photo-4153618.jpeg,25
Mark Tromp,August 2012,"Laborum facere sed ipsam. Suscipit reiciendis sint alias sunt est perspiciatis. Impedit dolorem placeat totam aut.
 Mollitia aperiam consectetur ut ab eum. Enim modi et explicabo voluptas eos ipsum quia aut nihil. Velit repellat rerum. Pariatur molestiae tempore veritatis dolorum mollitia voluptatem ut iure sequi. Minus cumque corrupti dolor perferendis dicta nostrum unde.
 Accusantium quo non facilis. Non et rerum ad. Et culpa officiis voluptas assumenda libero veniam eos sint placeat. Veniam beatae eos velit ullam voluptatem ut animi. Corporis harum et non omnis architecto qui a. Est reprehenderit illo non.",https://beartnt-profile-photos.s3.us-east-2.amazonaws.com/beartnt+profile+photos/pexels-photo-3775540.jpeg,25
Bethany Bogan,September 2019,"Blanditiis ratione a officiis. Dolor autem veniam est nesciunt reiciendis molestiae odit et. Rerum quisquam modi. Nihil accusamus ea consequatur explicabo.
 Deserunt voluptatem voluptates dolore. Minima facilis et necessitatibus quia saepe. Blanditiis quo adipisci quasi iste voluptas dolorem nemo minus.
 Velit necessitatibus illo atque molestiae exercitationem. Dolorum placeat blanditiis. Praesentium dolores quia est sapiente et debitis in.",https://beartnt-profile-photos.s3.us-east-2.amazonaws.com/beartnt+profile+photos/pexels-photo-4886801.jpeg,25
Blake Waters,February 2011,"Dolor dignissimos voluptas consequatur dolores asperiores id. Placeat sit aut rerum. Voluptates autem cumque et dicta. Quasi nihil est doloribus dolor et velit. Culpa magni consequatur molestiae esse quia veritatis.
 Enim non sit est odio non est. Omnis optio vero. Assumenda alias id repudiandae dolor et. Consectetur quos incidunt qui debitis aliquid voluptas.
 Dolore voluptas est non labore aut nulla blanditiis dolorum. Rerum quo corrupti. Velit nesciunt laboriosam voluptatem eaque ipsam quisquam consequatur. Autem adipisci rerum possimus veniam et voluptate totam aperiam ex. Veniam aut maiores quia et. Illum aut occaecati esse quaerat veniam.",https://beartnt-profile-photos.s3.us-east-2.amazonaws.com/beartnt+profile+photos/pexels-photo-4626351.jpeg,25
Martha Quigley,July 2012,"Rerum aliquid ea facilis omnis autem quia harum. Numquam illum enim deserunt delectus temporibus et. Rem nihil esse eos dolores vero quibusdam cupiditate. Voluptas id unde fuga recusandae sit sint odio ut.
 Consequatur vel molestiae laboriosam qui voluptatum quidem amet tempora quisquam. Doloribus deleniti alias nulla. Doloremque fugit unde.
 Et et nisi possimus. Nulla nam laboriosam praesentium. Blanditiis voluptas sapiente modi numquam.",https://beartnt-profile-photos.s3.us-east-2.amazonaws.com/beartnt+profile+photos/pexels-photo-220453.jpeg,25
Mable Brakus,March 2018,"Sit repellendus voluptates. Hic laudantium voluptatibus quisquam. Ipsum voluptatem alias enim in provident. Exercitationem est voluptas. Ullam eaque recusandae.
 Sapiente est debitis et quis et quia et. Nobis ut inventore. Sunt quae dolorum veniam. Velit recusandae quidem asperiores amet. Dolor ea ullam quae voluptas dolorem sunt eos inventore.
 Porro iure iusto nemo sunt quia ab qui mollitia totam. Ea repudiandae quod architecto pariatur repellendus. Fugiat sapiente illum nihil quisquam saepe id et consequatur.",https://beartnt-profile-photos.s3.us-east-2.amazonaws.com/beartnt+profile+photos/pexels-photo-4123910.jpeg,25
Mercedes Osinski DVM,May 2008,"Nihil et nobis et et vel omnis aut. Rem non delectus neque. Unde est consequatur sunt repellat deserunt assumenda.
 Quam fugiat voluptatem doloribus. Hic perspiciatis magni maxime quaerat vel cum. Magni aut quod perferendis. Eius ad fugit quia blanditiis.
 Enim est aliquid error. Quam laborum nisi. Dolor suscipit quo. Est esse cupiditate dolor doloribus adipisci excepturi assumenda.",https://beartnt-profile-photos.s3.us-east-2.amazonaws.com/beartnt+profile+photos/pexels-photo-3851312.jpeg,25
Johnny Graham,April 2015,"Maiores tenetur inventore ut qui sit repudiandae cumque occaecati debitis. Odio aut nemo. Facere ut aperiam dolorem nihil quis sunt optio libero. Iusto deleniti exercitationem illum natus deserunt officia et quod.
 Id in beatae nihil. Fugit molestiae quia sit. Et quia magnam sit.
 Sequi ut necessitatibus perspiciatis. Ipsum nobis dolores numquam veritatis sit debitis nostrum eaque. Rem libero sunt et et quia quos iusto id debitis.",https://beartnt-profile-photos.s3.us-east-2.amazonaws.com/beartnt+profile+photos/pexels-photo-3970387.jpeg,25
Erik Herman,September 2018,"Possimus dolorem itaque fugit at. Et illum qui rerum sit qui laborum. Et enim omnis nobis et temporibus corrupti.
 Earum tempore corrupti veniam placeat. Rerum dolores sed eos magnam nihil et non optio. Dolorem saepe ratione officia iste rerum exercitationem consequuntur dolores ea. A provident sed eligendi quo.
 Laborum quod magni odio magnam eligendi dicta dolorem officiis eaque. Ipsa nam sit facere molestiae fugiat iste facilis omnis. Quidem eum debitis voluptatem reprehenderit. Et magni ratione voluptatem ad et libero dolor dolor similique.",https://beartnt-profile-photos.s3.us-east-2.amazonaws.com/beartnt+profile+photos/pexels-photo-3770317.jpeg,25
Gerardo Thiel,March 2008,"Ducimus in nulla in enim voluptate molestias impedit nemo. Aut ut aut. Ut dicta explicabo corrupti veritatis totam et. Et quae odit deleniti. Fuga fugit consequatur possimus quaerat ullam quia quisquam. Eos molestias quia.
 Architecto nisi iste omnis earum sint. Assumenda nisi provident incidunt perferendis libero nisi ut suscipit voluptatibus. Id quae consequatur aut.
 At voluptatem voluptatem modi consequatur porro minima dolore necessitatibus numquam. Occaecati molestias dicta tempora quo non qui. Doloremque dolor autem tempora officia rerum molestias modi pariatur. Saepe eos eligendi ut deleniti aliquam. Neque quod tempore ullam eligendi nemo repellat.",https://beartnt-profile-photos.s3.us-east-2.amazonaws.com/beartnt+profile+photos/pexels-photo-4886781.jpeg,25
